# Screeps Eternal Agent

你是 Screeps 游戏的永恒 AI Agent。

## ⚠️ 首先检查待处理事件

**立即检查 `events/pending.json`**，如果存在且有内容：
- `critical` 优先级 → 立即处理，可能是攻击/Spawn被毁
- `high` 优先级 → 优先处理，可能是 Creep 全灭
- 处理完成后删除该文件

## 任务流程

1. **检查事件** - 读取 `events/pending.json`
2. **阅读 AGENTS.md** - 了解使命和约束
3. **遍历文件** - 理解当前状态，读取 knowledge/ 经验
4. **检查游戏** - 调用 Screeps API
5. **采取行动** - 修改代码，上传到游戏
6. **固化知识** - 写入 knowledge/
7. **Git 提交** - `git add -A && git commit -m " message"`

## 凭证

- Token: `.env` 文件中的 `SCREEPS_TOKEN`
- 用户: payyy
- 房间: E13S35 (shard3)

## 约束

- 所有操作限制在 `/Users/moonshot/dev/infinite-screeps/` 目录
- 每次修改后必须 git commit
- 免费玩家: CPU 20, shard3, 最多1个房间

**现在开始工作。**
TurnBegin(
    user_input='# Screeps Eternal Agent\n\n你是 Screeps 游戏的永恒 AI 
Agent。\n\n## ⚠️ 首先检查待处理事件\n\n**立即检查 
`events/pending.json`**，如果存在且有内容：\n- `critical` 优先级 → 
立即处理，可能是攻击/Spawn被毁\n- `high` 优先级 → 优先处理，可能是 Creep 全灭\n-
处理完成后删除该文件\n\n## 任务流程\n\n1. **检查事件** - 读取 
`events/pending.json`\n2. **阅读 AGENTS.md** - 了解使命和约束\n3. **遍历文件** -
理解当前状态，读取 knowledge/ 经验\n4. **检查游戏** - 调用 Screeps API\n5. 
**采取行动** - 修改代码，上传到游戏\n6. **固化知识** - 写入 knowledge/\n7. **Git
提交** - `git add -A && git commit -m "[type] message"`\n\n## 凭证\n\n- Token: 
`.env` 文件中的 `SCREEPS_TOKEN`\n- 用户: payyy\n- 房间: E13S35 (shard3)\n\n## 
约束\n\n- 所有操作限制在 `/Users/moonshot/dev/infinite-screeps/` 目录\n- 
每次修改后必须 git commit\n- 免费玩家: CPU 20, shard3, 
最多1个房间\n\n**现在开始工作。**'
)
StepBegin(n=1)
ToolCall(
    type='function',
    id='toolu_01BhKz4qMV3odcymVtRngyvU',
    function=FunctionBody(
        name='ReadFile',
        arguments='{"path": "events/pending.json"}'
    ),
    extras=None
)
ToolCall(
    type='function',
    id='toolu_015BQy3vqLjeS3oUFjupPVwg',
    function=FunctionBody(name='Shell', arguments=''),
    extras=None
)
ToolResult(
    tool_call_id='toolu_01BhKz4qMV3odcymVtRngyvU',
    return_value=ToolError(
        is_error=True,
        output='',
        message='`events/pending.json` does not exist.',
        display=[BriefDisplayBlock(type='brief', text='File not found')],
        extras=None
    )
)
ToolCallPart(
    arguments_part='{"command": "source .env && curl -s 
\\"https://screeps.com/api/game/room-terrain?room=E13S35&shard=shard3&encoded=tr
ue\\" -H \\"X-Token: $SCREEPS_TOKEN\\" | head -c 500"}'
)
StatusUpdate(
    context_usage=0.043555,
    token_usage=TokenUsage(
        input_other=3,
        output=150,
        input_cache_read=4629,
        input_cache_creation=4079
    ),
    message_id='msg_012KDUWpCq9TDbgJqAnnbavP'
)
ToolResult(
    tool_call_id='toolu_015BQy3vqLjeS3oUFjupPVwg',
    return_value=ToolReturnValue(
        is_error=False,
        output='{"ok":1,"terrain":[{"_id":"5bbcadb59099fc012e637abf","room":"E13
S35","terrain":"1111110001111111111111111111111111111111111111111111001100000000
11100111100001111000000000011100001110000000000000000000111000000000000000000000
00000110000000000000000000212000000000002200000000000001100000000000000000022211
00000011022220000000000001100000000000000000002221100001110022000000111110111000
00000000000000000001110001110000000001111111111000000000000000000000011100011100
000000001111111110000000011000011000',
        message='Command executed successfully.',
        display=[],
        extras=None
    )
)
StepBegin(n=2)
TextPart(type='text', text='没有待处理事件。让我继续检查游戏状态和当前代码。')
ToolCall(
    type='function',
    id='toolu_01NELqjHwjVms2yUH2HTQJce',
    function=FunctionBody(
        name='Shell',
        arguments='{"command": "source .env && curl -s 
\\"https://screeps.com/api/game/room-objects?room=E13S35&shard=shard3\\" -H 
\\"X-Token: $SCREEPS_TOKEN\\" | python3 -c \\"\\nimport json, sys\\ndata = 
json.load(sys.stdin)\\nif data.get(\'ok\') != 1:\\n    print(\'Error:\', 
data)\\n    sys.exit(1)\\n\\nobjs = data.get(\'objects\', {})\\n# Summarize by 
type\\ntypes = {}\\nfor k, v in objs.items():\\n    t = v.get(\'type\', 
\'unknown\')\\n    types[t] = types.get(t, 0) + 1\\n\\nprint(\'=== Object Types 
===\')\\nfor t, c in sorted(types.items(), key=lambda x: -x[1]):\\n    
print(f\'{t}: {c}\')\\n\\nprint()\\nprint(\'=== Controller ===\')\\nfor k, v in 
objs.items():\\n    if v.get(\'type\') == \'controller\':\\n        
print(f\\\\\\"Level: {v.get(\'level\')}, Progress: 
{v.get(\'progress\')}/{v.get(\'progressTotal\')}\\\\\\")\\n        
print(f\\\\\\"SafeMode: {v.get(\'safeMode\')}, SafeModeAvailable: 
{v.get(\'safeModeAvailable\')}\\\\\\")\\n        print(f\\\\\\"DowngradeTime: 
{v.get(\'downgradeTime\')}\\\\\\")\\n\\nprint()\\nprint(\'=== Spawn ===\')\\nfor
k, v in objs.items():\\n    if v.get(\'type\') == \'spawn\':\\n        
print(f\\\\\\"{v.get(\'name\')}: 
energy={v.get(\'energy\')}/{v.get(\'energyCapacity\')}, 
spawning={v.get(\'spawning\')}\\\\\\")\\n\\nprint()\\nprint(\'=== Creeps 
===\')\\nfor k, v in objs.items():\\n    if v.get(\'type\') == \'creep\' and 
v.get(\'user\') == list(objs.values())[0].get(\'user\', \'\'):\\n        # Find 
our user\\n        pass\\nfor k, v in objs.items():\\n    if v.get(\'type\') == 
\'creep\':\\n        body = v.get(\'body\', [])\\n        parts = 
[p.get(\'type\', \'?\')[0].upper() for p in body]\\n        
print(f\\\\\\"{v.get(\'name\')}: {\'\'.join(parts)} 
hits={v.get(\'hits\')}/{v.get(\'hitsMax\')} 
fatigue={v.get(\'fatigue\')}\\\\\\")\\n\\nprint()\\nprint(\'=== Towers 
===\')\\nfor k, v in objs.items():\\n    if v.get(\'type\') == \'tower\':\\n    
print(f\\\\\\"Tower at ({v.get(\'x\')},{v.get(\'y\')}): 
energy={v.get(\'energy\')}/{v.get(\'energyCapacity\')}\\\\\\")\\n\\nprint()\\npr
int(\'=== Construction Sites ===\')\\nfor k, v in objs.items():\\n    if 
v.get(\'type\') == \'constructionSite\':\\n        
print(f\\\\\\"{v.get(\'structureType\')} at ({v.get(\'x\')},{v.get(\'y\')}): 
{v.get(\'progress\')}/{v.get(\'progressTotal\')}\\\\\\")\\n\\nprint()\\nprint(\'
=== Extensions ===\')\\ncount = 0\\nfor k, v in objs.items():\\n    if 
v.get(\'type\') == \'extension\':\\n        count += 1\\nprint(f\'Total 
extensions: {count}\')\\n\\nprint()\\nprint(\'=== Sources ===\')\\nfor k, v in 
objs.items():\\n    if v.get(\'type\') == \'source\':\\n        
print(f\\\\\\"Source at ({v.get(\'x\')},{v.get(\'y\')}): 
energy={v.get(\'energy\')}/{v.get(\'energyCapacity\')}\\\\\\")\\n\\"\\n"}'
    ),
    extras=None
)
ToolCall(
    type='function',
    id='toolu_019d9jXaA7TtFSovE7pa9zDV',
    function=FunctionBody(
        name='ReadFile',
        arguments='{"path": "screeps/main.js"}'
    ),
    extras=None
)
ToolCall(
    type='function',
    id='toolu_01198brqgKBguhirnCwURa3j',
    function=FunctionBody(name='Glob', arguments=''),
    extras=None
)
ToolResult(
    tool_call_id='toolu_019d9jXaA7TtFSovE7pa9zDV',
    return_value=ToolOk(
        is_error=False,
        output="     1\t/**\n     2\t * Screeps Eternal - Event-Driven v4\n     
3\t * \n     4\t * 事件系统: 输出到控制台供 watcher 监听\n     5\t * 战斗日志: 
使用 room.getEventLog() 记录攻击详情到 Memory\n     6\t */\n     7\t\n     8\t//
========== 事件系统 ==========\n     9\t\n    10\tfunction emitEvent(type, value
= '') {\n    11\t    const msg = value ? `[EVENT:${type}:${value}]` : 
`[EVENT:${type}]`;\n    12\t    console.log(msg);\n    13\t}\n    14\t\n    
15\t// 记录战斗日志 (只在检测到战斗时调用)\n    16\tfunction 
recordCombatLog(room, trigger) {\n    17\t    const events = 
room.getEventLog();\n    18\t    \n    19\t    // 筛选攻击和摧毁事件\n    20\t  
const combatEvents = events.filter(e => \n    21\t        e.event === 
EVENT_ATTACK || \n    22\t        e.event === EVENT_OBJECT_DESTROYED\n    23\t  
);\n    24\t    \n    25\t    if (combatEvents.length === 0) return;\n    26\t  
\n    27\t    // 构建战斗日志\n    28\t    const log = {\n    29\t        time: 
Game.time,\n    30\t        trigger: trigger,\n    31\t        events: 
combatEvents.map(e => {\n    32\t            const attacker = 
Game.getObjectById(e.objectId);\n    33\t            const target = 
e.data.targetId ? Game.getObjectById(e.data.targetId) : null;\n    34\t         
\n    35\t            return {\n    36\t                type: e.event === 
EVENT_ATTACK ? 'ATTACK' : 'DESTROYED',\n    37\t                attackerId: 
e.objectId,\n    38\t                attackerOwner: attacker ? (attacker.owner ?
attacker.owner.username : 'unknown') : 'gone',\n    39\t                
targetId: e.data.targetId,\n    40\t                targetType: e.data.type || 
(target ? target.structureType || 'creep' : 'unknown'),\n    41\t               
damage: e.data.damage,\n    42\t                attackType: e.data.attackType\n 
43\t            };\n    44\t        })\n    45\t    };\n    46\t    \n    47\t  
// 保存到 Memory (保留最近 20 条)\n    48\t    Memory.combatLog = 
Memory.combatLog || [];\n    49\t    Memory.combatLog.unshift(log);\n    50\t   
if (Memory.combatLog.length > 20) {\n    51\t        Memory.combatLog = 
Memory.combatLog.slice(0, 20);\n    52\t    }\n    53\t}\n    54\t\n    
55\tfunction checkEvents(room, spawn) {\n    56\t    const mem = Memory.events 
|| {};\n    57\t    const controller = room.controller;\n    58\t    let 
combatDetected = false;\n    59\t    let combatTrigger = '';\n    60\t    \n    
61\t    // ===== 敌人检测 =====\n    62\t    const hostiles = 
room.find(FIND_HOSTILE_CREEPS);\n    63\t    if (hostiles.length > 0) {\n    
64\t        if (!mem.hostileDetected) {\n    65\t            // 新敌人出现\n    
66\t            const info = hostiles.map(h => 
`${h.owner.username}(${h.body.length}parts)`).join(',');\n    67\t            
emitEvent('HOSTILE', `${hostiles.length}:${info}`);\n    68\t            
combatDetected = true;\n    69\t            combatTrigger = 
'hostile_detected';\n    70\t        }\n    71\t        mem.hostileDetected = 
Game.time;\n    72\t    } else {\n    73\t        mem.hostileDetected = null;\n 
74\t    }\n    75\t    \n    76\t    // ===== Spawn 被攻击 =====\n    77\t    if
(spawn.hits < spawn.hitsMax) {\n    78\t        if (!mem.spawnAttacked) {\n    
79\t            emitEvent('SPAWN_ATTACKED', `${spawn.hits}/${spawn.hitsMax}`);\n
80\t            mem.spawnAttacked = true;\n    81\t            combatDetected = 
true;\n    82\t            combatTrigger = 'spawn_attacked';\n    83\t        
}\n    84\t    } else {\n    85\t        mem.spawnAttacked = false;\n    86\t   
}\n    87\t    \n    88\t    // ===== RCL 升级 =====\n    89\t    if 
(mem.lastLevel !== undefined && controller.level > mem.lastLevel) {\n    90\t   
emitEvent('RCL_UP', controller.level);\n    91\t    }\n    92\t    mem.lastLevel
= controller.level;\n    93\t    \n    94\t    // ===== 控制器降级警告 (分级) 
=====\n    95\t    const ttd = controller.ticksToDowngrade;\n    96\t    if (ttd
< 1000 && mem.downgradeLevel !== 'CRITICAL') {\n    97\t        
emitEvent('DOWNGRADE_CRITICAL', ttd);\n    98\t        mem.downgradeLevel = 
'CRITICAL';\n    99\t    } else if (ttd < 5000 && ttd >= 1000 && 
mem.downgradeLevel !== 'URGENT') {\n   100\t        
emitEvent('DOWNGRADE_URGENT', ttd);\n   101\t        mem.downgradeLevel = 
'URGENT';\n   102\t    } else if (ttd < 20000 && ttd >= 5000 && 
mem.downgradeLevel !== 'WARNING') {\n   103\t        
emitEvent('DOWNGRADE_WARNING', ttd);\n   104\t        mem.downgradeLevel = 
'WARNING';\n   105\t    } else if (ttd >= 20000) {\n   106\t        
mem.downgradeLevel = null;\n   107\t    }\n   108\t    \n   109\t    // ===== 
Creep 死亡检测 =====\n   110\t    const currentCreeps = 
Object.keys(Game.creeps);\n   111\t    const lastCreeps = mem.lastCreeps || 
[];\n   112\t    \n   113\t    for (const name of lastCreeps) {\n   114\t       
if (!Game.creeps[name]) {\n   115\t            const role = mem.creepRoles ? 
mem.creepRoles[name] : 'unknown';\n   116\t            emitEvent('CREEP_DIED', 
`${role}:${name}`);\n   117\t            combatDetected = true;\n   118\t       
combatTrigger = `creep_died:${role}`;\n   119\t        }\n   120\t    }\n   
121\t    \n   122\t    mem.lastCreeps = currentCreeps;\n   123\t    
mem.creepRoles = mem.creepRoles || {};\n   124\t    for (const name in 
Game.creeps) {\n   125\t        mem.creepRoles[name] = 
Game.creeps[name].memory.role;\n   126\t    }\n   127\t    for (const name in 
mem.creepRoles) {\n   128\t        if (!Game.creeps[name]) delete 
mem.creepRoles[name];\n   129\t    }\n   130\t    \n   131\t    if 
(currentCreeps.length === 0 && lastCreeps.length > 0) {\n   132\t        
emitEvent('NO_CREEPS');\n   133\t    }\n   134\t    \n   135\t    // ===== Creep
受伤检测 =====\n   136\t    mem.creepHits = mem.creepHits || {};\n   137\t    
for (const name in Game.creeps) {\n   138\t        const creep = 
Game.creeps[name];\n   139\t        const lastHits = mem.creepHits[name] !== 
undefined ? mem.creepHits[name] : creep.hitsMax;\n   140\t        \n   141\t    
if (creep.hits < lastHits) {\n   142\t            const role = 
creep.memory.role;\n   143\t            const hpPercent = Math.round(creep.hits 
/ creep.hitsMax * 100);\n   144\t            emitEvent('CREEP_HURT', 
`${role}:${name}:${hpPercent}%`);\n   145\t            combatDetected = true;\n 
146\t            combatTrigger = `creep_hurt:${role}`;\n   147\t        }\n   
148\t        mem.creepHits[name] = creep.hits;\n   149\t    }\n   150\t    for 
(const name in mem.creepHits) {\n   151\t        if (!Game.creeps[name]) delete 
mem.creepHits[name];\n   152\t    }\n   153\t    \n   154\t    // ===== Creep 
寿命警告 =====\n   155\t    mem.agingWarned = mem.agingWarned || {};\n   156\t  
for (const name in Game.creeps) {\n   157\t        const creep = 
Game.creeps[name];\n   158\t        if (creep.ticksToLive === undefined) 
continue; // spawning\n   159\t        const spawnTime = creep.body.length * 3; 
// CREEP_SPAWN_TIME = 3\n   160\t        const threshold = spawnTime * 2; // 
给余量让替代 creep 孵化\n   161\t        if (creep.ticksToLive <= threshold && 
!mem.agingWarned[name]) {\n   162\t            const role = creep.memory.role;\n
163\t            emitEvent('CREEP_AGING', 
`${role}:${name}:${creep.ticksToLive}t`);\n   164\t            
mem.agingWarned[name] = true;\n   165\t        }\n   166\t    }\n   167\t    for
(const name in mem.agingWarned) {\n   168\t        if (!Game.creeps[name]) 
delete mem.agingWarned[name];\n   169\t    }\n   170\t    \n   171\t    // =====
低能量 =====\n   172\t    if (room.energyAvailable < 200 && currentCreeps.length
=== 0) {\n   173\t        emitEvent('LOW_ENERGY', room.energyAvailable);\n   
174\t    }\n   175\t    \n   176\t    // ===== 记录战斗日志 (只在检测到战斗时) 
=====\n   177\t    if (combatDetected) {\n   178\t        recordCombatLog(room, 
combatTrigger);\n   179\t    }\n   180\t    \n   181\t    // ===== 建筑完成检测 
(每 10 ticks) =====\n   182\t    if (Game.time % 10 === 0) {\n   183\t        
const structures = room.find(FIND_MY_STRUCTURES);\n   184\t        const counts 
= {};\n   185\t        for (const s of structures) {\n   186\t            
counts[s.structureType] = (counts[s.structureType] || 0) + 1;\n   187\t        
}\n   188\t        \n   189\t        if (mem.extensionCount !== undefined && 
(counts.extension || 0) > mem.extensionCount) {\n   190\t            
emitEvent('EXTENSION_BUILT', counts.extension);\n   191\t        }\n   192\t    
mem.extensionCount = counts.extension || 0;\n   193\t        \n   194\t        
if (mem.towerCount !== undefined && (counts.tower || 0) > mem.towerCount) {\n   
195\t            emitEvent('TOWER_BUILT', counts.tower);\n   196\t        }\n   
197\t        mem.towerCount = counts.tower || 0;\n   198\t        \n   199\t    
if (mem.storageCount !== undefined && (counts.storage || 0) > mem.storageCount) 
{\n   200\t            emitEvent('STORAGE_BUILT', counts.storage);\n   201\t    
}\n   202\t        mem.storageCount = counts.storage || 0;\n   203\t    }\n   
204\t    \n   205\t    Memory.events = mem;\n   206\t}\n   207\t\n   208\t// 
========== 配置 ==========\n   209\t\n   210\tfunction getCreepTargets(room) {\n
211\t    const level = room.controller.level;\n   212\t    const sites = 
room.find(FIND_MY_CONSTRUCTION_SITES).length;\n   213\t    \n   214\t    // 2 
Sources 最多产 20 energy/tick\n   215\t    // 3 Harvester (9 WORK) = 18 
energy/tick, 足够\n   216\t    if (level <= 2) {\n   217\t        return { 
harvester: 4, builder: sites > 0 ? 3 : 1, upgrader: 3 };\n   218\t    } else if 
(level === 3) {\n   219\t        // RCL3: 优先升级到 RCL4\n   220\t        
return { harvester: 3, builder: sites > 0 ? 2 : 0, upgrader: 4 };\n   221\t    }
else if (level === 4) {\n   222\t        // RCL4: 需要建造 10 Extensions + 
Storage, builder 优先\n   223\t        return { harvester: 3, builder: sites > 0
? 3 : 1, upgrader: 3 };\n   224\t    } else {\n   225\t        // RCL5+: 
平衡配置\n   226\t        return { harvester: 3, builder: sites > 0 ? 2 : 1, 
upgrader: 3 };\n   227\t    }\n   228\t}\n   229\t\n   230\tfunction 
getBody(role, energy) {\n   231\t    if (energy >= 550) {\n   232\t        if 
(role === 'harvester' || role === 'upgrader') {\n   233\t            return 
[WORK, WORK, WORK, CARRY, CARRY, MOVE, MOVE, MOVE];\n   234\t        }\n   235\t
return [WORK, WORK, CARRY, CARRY, MOVE, MOVE, MOVE, MOVE];\n   236\t    } else 
if (energy >= 400) {\n   237\t        return [WORK, WORK, CARRY, CARRY, MOVE, 
MOVE];\n   238\t    } else if (energy >= 300) {\n   239\t        return [WORK, 
WORK, CARRY, MOVE];\n   240\t    }\n   241\t    return [WORK, CARRY, MOVE];\n   
242\t}\n   243\t\n   244\tfunction getBuildPositions(spawn) {\n   245\t    const
sx = spawn.pos.x, sy = spawn.pos.y;\n   246\t    return {\n   247\t        // 
RCL2: 5, RCL3: 10, RCL4: 20, RCL5: 30\n   248\t        // 
包含备用位置以防某些位置被占用\n   249\t        extensions: [\n   250\t         
// Ring 1 (positions 1-4)\n   251\t            {x: sx-1, y: sy-1}, {x: sx+1, y: 
sy-1}, {x: sx-1, y: sy+1}, {x: sx+1, y: sy+1},\n   252\t            // Ring 2 
(positions 5-10) - 注意 sy-2 可能被 Tower 占用\n   253\t            {x: sx+2, y:
sy}, {x: sx-2, y: sy}, {x: sx, y: sy-2}, {x: sx, y: sy+2},\n   254\t            
{x: sx+2, y: sy-1}, {x: sx-2, y: sy-1},\n   255\t            // Ring 3 
(positions 11-22) - for RCL4, 含备用位置\n   256\t            {x: sx+2, y: 
sy+1}, {x: sx-2, y: sy+1}, {x: sx+3, y: sy}, {x: sx-3, y: sy},\n   257\t        
{x: sx+3, y: sy-1}, {x: sx-3, y: sy-1}, {x: sx+3, y: sy+1}, {x: sx-3, y: 
sy+1},\n   258\t            {x: sx+2, y: sy-2}, {x: sx-2, y: sy-2},\n   259\t   
{x: sx+4, y: sy}, {x: sx-4, y: sy},  // 备用位置\n   260\t            // Ring 4 
(positions 23-34) - for RCL5, 含备用位置\n   261\t            {x: sx+2, y: 
sy+2}, {x: sx-2, y: sy+2}, {x: sx+1, y: sy-3}, {x: sx-1, y: sy-3},\n   262\t    
{x: sx+1, y: sy+3}, {x: sx-1, y: sy+3}, {x: sx+3, y: sy-2}, {x: sx-3, y: 
sy-2},\n   263\t            {x: sx+3, y: sy+2}, {x: sx-3, y: sy+2},\n   264\t   
{x: sx+4, y: sy-1}, {x: sx-4, y: sy-1}  // 备用位置\n   265\t        ],\n   
266\t        towers: [{x: sx, y: sy-2}, {x: sx-2, y: sy-2}],  // 2nd tower for 
RCL5\n   267\t        storage: [{x: sx-1, y: sy}]  // Storage for RCL4\n   268\t
};\n   269\t}\n   270\t\n   271\t// ========== 主循环 ==========\n   272\t\n   
273\tmodule.exports.loop = function () {\n   274\t    // 清理\n   275\t    for 
(const name in Memory.creeps) {\n   276\t        if (!Game.creeps[name]) delete 
Memory.creeps[name];\n   277\t    }\n   278\t    \n   279\t    // 获取 Spawn\n  
280\t    const spawns = Object.values(Game.spawns);\n   281\t    if 
(spawns.length === 0) {\n   282\t        emitEvent('NO_SPAWN');\n   283\t       
return;\n   284\t    }\n   285\t    const spawn = spawns[0];\n   286\t    const 
room = spawn.room;\n   287\t    const controller = room.controller;\n   288\t   
\n   289\t    // 检测事件\n   290\t    checkEvents(room, spawn);\n   291\t    \n
292\t    // Creep 管理\n   293\t    const targets = getCreepTargets(room);\n   
294\t    const counts = { harvester: 0, builder: 0, upgrader: 0 };\n   295\t    
for (const name in Game.creeps) {\n   296\t        const role = 
Game.creeps[name].memory.role;\n   297\t        if (counts[role] !== undefined) 
counts[role]++;\n   298\t    }\n   299\t    \n   300\t    // 建筑规划\n   301\t 
if (Game.time % 50 === 0) planBuildings(room, controller.level, spawn);\n   
302\t    \n   303\t    // 孵化\n   304\t    if (!spawn.spawning) {\n   305\t    
const energy = room.energyAvailable;\n   306\t        const capacity = 
room.energyCapacityAvailable;\n   307\t        \n   308\t        // 紧急模式: 
harvester 不足 2 个时，用任何可用能量孵化\n   309\t        // 正常模式: 等待至少
550 能量 (或满容量) 孵化更强的 creep\n   310\t        const isEmergency = 
counts.harvester < 2;\n   311\t        const minSpawnEnergy = isEmergency ? 200 
: Math.min(550, capacity);\n   312\t        \n   313\t        for (const role of
['harvester', 'builder', 'upgrader']) {\n   314\t            if (counts[role] < 
targets[role]) {\n   315\t                if (energy >= minSpawnEnergy) {\n   
316\t                    // 使用当前可用能量 (最多到 capacity)\n   317\t        
const useEnergy = Math.min(capacity, energy);\n   318\t                    const
body = getBody(role, useEnergy);\n   319\t                    const name = role 
+ Game.time;\n   320\t                    if (spawn.spawnCreep(body, name, { 
memory: { role } }) === OK) {\n   321\t                        
emitEvent('SPAWN_COMPLETE', name);\n   322\t                    }\n   323\t     
}\n   324\t                break;\n   325\t            }\n   326\t        }\n   
327\t    }\n   328\t    \n   329\t    // 运行 Creep\n   330\t    for (const name
in Game.creeps) {\n   331\t        const creep = Game.creeps[name];\n   332\t   
const role = creep.memory.role;\n   333\t        if (role === 'harvester') 
runHarvester(creep);\n   334\t        else if (role === 'upgrader') 
runUpgrader(creep);\n   335\t        else if (role === 'builder') 
runBuilder(creep);\n   336\t    }\n   337\t    \n   338\t    // Tower 防御\n   
339\t    runTowers(room);\n   340\t    \n   341\t    // 状态 (每 100 ticks)\n   
342\t    if (Game.time % 100 === 0) {\n   343\t        const cpu = 
Game.cpu.getUsed();\n   344\t        console.log(`[STATUS] T:${Game.time} 
CPU:${cpu.toFixed(1)} Creeps:${Object.keys(Game.creeps).length} 
RCL:${controller.level}`);\n   345\t    }\n   346\t};\n   347\t\n   348\t// 
========== 建筑规划 ==========\n   349\t\n   350\tfunction planBuildings(room, 
level, spawn) {\n   351\t    const plans = getBuildPositions(spawn);\n   352\t  
\n   353\t    const maxExt = 
CONTROLLER_STRUCTURES[STRUCTURE_EXTENSION][level];\n   354\t    const curExt = 
room.find(FIND_MY_STRUCTURES, { filter: s => s.structureType === 
STRUCTURE_EXTENSION }).length;\n   355\t    const siteExt = 
room.find(FIND_MY_CONSTRUCTION_SITES, { filter: s => s.structureType === 
STRUCTURE_EXTENSION }).length;\n   356\t    \n   357\t    let needed = maxExt - 
curExt - siteExt;\n   358\t    for (const pos of plans.extensions) {\n   359\t  
if (needed <= 0) break;\n   360\t        if (canBuildAt(room, pos.x, pos.y)) {\n
361\t            if (room.createConstructionSite(pos.x, pos.y, 
STRUCTURE_EXTENSION) === OK) needed--;\n   362\t        }\n   363\t    }\n   
364\t    \n   365\t    // Tower (RCL3+)\n   366\t    if (level >= 3) {\n   367\t
const maxTowers = CONTROLLER_STRUCTURES[STRUCTURE_TOWER][level];\n   368\t      
const curTowers = room.find(FIND_MY_STRUCTURES, { filter: s => s.structureType 
=== STRUCTURE_TOWER }).length;\n   369\t        const siteTowers = 
room.find(FIND_MY_CONSTRUCTION_SITES, { filter: s => s.structureType === 
STRUCTURE_TOWER }).length;\n   370\t        \n   371\t        if (curTowers + 
siteTowers < maxTowers) {\n   372\t            for (const pos of plans.towers) 
{\n   373\t                if (canBuildAt(room, pos.x, pos.y)) {\n   374\t      
room.createConstructionSite(pos.x, pos.y, STRUCTURE_TOWER);\n   375\t           
break;\n   376\t                }\n   377\t            }\n   378\t        }\n   
379\t    }\n   380\t    \n   381\t    // Storage (RCL4+)\n   382\t    if (level 
>= 4 && plans.storage) {\n   383\t        const curStorage = 
room.find(FIND_MY_STRUCTURES, { filter: s => s.structureType === 
STRUCTURE_STORAGE }).length;\n   384\t        const siteStorage = 
room.find(FIND_MY_CONSTRUCTION_SITES, { filter: s => s.structureType === 
STRUCTURE_STORAGE }).length;\n   385\t        \n   386\t        if (curStorage +
siteStorage === 0) {\n   387\t            for (const pos of plans.storage) {\n  
388\t                if (canBuildAt(room, pos.x, pos.y)) {\n   389\t            
room.createConstructionSite(pos.x, pos.y, STRUCTURE_STORAGE);\n   390\t         
break;\n   391\t                }\n   392\t            }\n   393\t        }\n   
394\t    }\n   395\t    \n   396\t    // Rampart 保护关键建筑 (RCL2+)\n   397\t 
if (level >= 2) {\n   398\t        // 保护 Spawn\n   399\t        const 
spawnRampart = room.lookForAt(LOOK_STRUCTURES, spawn.pos.x, spawn.pos.y)\n   
400\t            .some(s => s.structureType === STRUCTURE_RAMPART);\n   401\t   
const spawnRampartSite = room.lookForAt(LOOK_CONSTRUCTION_SITES, spawn.pos.x, 
spawn.pos.y)\n   402\t            .some(s => s.structureType === 
STRUCTURE_RAMPART);\n   403\t        if (!spawnRampart && !spawnRampartSite) {\n
404\t            room.createConstructionSite(spawn.pos.x, spawn.pos.y, 
STRUCTURE_RAMPART);\n   405\t        }\n   406\t        \n   407\t        // 
保护 Tower\n   408\t        const towers = room.find(FIND_MY_STRUCTURES, { 
filter: s => s.structureType === STRUCTURE_TOWER });\n   409\t        for (const
tower of towers) {\n   410\t            const hasRampart = 
room.lookForAt(LOOK_STRUCTURES, tower.pos.x, tower.pos.y)\n   411\t             
.some(s => s.structureType === STRUCTURE_RAMPART);\n   412\t            const 
hasSite = room.lookForAt(LOOK_CONSTRUCTION_SITES, tower.pos.x, tower.pos.y)\n   
413\t                .some(s => s.structureType === STRUCTURE_RAMPART);\n   
414\t            if (!hasRampart && !hasSite) {\n   415\t                
room.createConstructionSite(tower.pos.x, tower.pos.y, STRUCTURE_RAMPART);\n   
416\t            }\n   417\t        }\n   418\t    }\n   419\t}\n   420\t\n   
421\tfunction canBuildAt(room, x, y) {\n   422\t    if (x < 1 || x > 48 || y < 1
|| y > 48) return false;\n   423\t    return room.lookForAt(LOOK_STRUCTURES, x, 
y).length === 0 &&\n   424\t           room.lookForAt(LOOK_CONSTRUCTION_SITES, 
x, y).length === 0 &&\n   425\t           room.getTerrain().get(x, y) !== 
TERRAIN_MASK_WALL;\n   426\t}\n   427\t\n   428\t// ========== Tower 
==========\n   429\t\n   430\tfunction runTowers(room) {\n   431\t    const 
towers = room.find(FIND_MY_STRUCTURES, { filter: s => s.structureType === 
STRUCTURE_TOWER });\n   432\t    \n   433\t    for (const tower of towers) {\n  
434\t        // 优先攻击敌人\n   435\t        const enemy = 
tower.pos.findClosestByRange(FIND_HOSTILE_CREEPS);\n   436\t        if (enemy) {
tower.attack(enemy); continue; }\n   437\t        \n   438\t        // 
修复受损建筑 (不含 walls)\n   439\t        const damaged = 
tower.pos.findClosestByRange(FIND_STRUCTURES, {\n   440\t            filter: s 
=> s.hits < s.hitsMax * 0.5 && \n   441\t                        s.structureType
!== STRUCTURE_WALL\n   442\t        });\n   443\t        if (damaged && 
tower.store[RESOURCE_ENERGY] > 500) { tower.repair(damaged); continue; }\n   
444\t        \n   445\t        // 空闲时加固 Ramparts (目标 100K HP，与 builder 
保持一致)\n   446\t        const weakRampart = 
tower.pos.findClosestByRange(FIND_MY_STRUCTURES, {\n   447\t            filter: 
s => s.structureType === STRUCTURE_RAMPART && s.hits < 100000\n   448\t        
});\n   449\t        if (weakRampart && tower.store[RESOURCE_ENERGY] > 700) 
tower.repair(weakRampart);\n   450\t    }\n   451\t}\n   452\t\n   453\t// 
========== Creep 行为 ==========\n   454\t\n   455\tfunction runHarvester(creep)
{\n   456\t    if (creep.memory.working && creep.store[RESOURCE_ENERGY] === 0) 
{\n   457\t        creep.memory.working = false;\n   458\t        delete 
creep.memory.targetId;\n   459\t    }\n   460\t    if (!creep.memory.working && 
creep.store.getFreeCapacity() === 0) {\n   461\t        creep.memory.working = 
true;\n   462\t        delete creep.memory.targetId;\n   463\t    }\n   464\t   
\n   465\t    if (creep.memory.working) {\n   466\t        let target = 
Game.getObjectById(creep.memory.targetId);\n   467\t        if (!target || 
(target.store && target.store.getFreeCapacity(RESOURCE_ENERGY) === 0)) {\n   
468\t            target = creep.pos.findClosestByPath(FIND_MY_STRUCTURES, {\n   
469\t                filter: s => (s.structureType === STRUCTURE_SPAWN ||\n   
470\t                             s.structureType === STRUCTURE_EXTENSION ||\n  
471\t                             s.structureType === STRUCTURE_TOWER) &&\n   
472\t                             s.store.getFreeCapacity(RESOURCE_ENERGY) > 0\n
473\t            });\n   474\t            creep.memory.targetId = target ? 
target.id : null;\n   475\t        }\n   476\t        if (target) {\n   477\t   
if (creep.transfer(target, RESOURCE_ENERGY) === ERR_NOT_IN_RANGE) 
creep.moveTo(target, {reusePath: 5});\n   478\t        } else {\n   479\t       
if (creep.upgradeController(creep.room.controller) === ERR_NOT_IN_RANGE) 
creep.moveTo(creep.room.controller, {reusePath: 5});\n   480\t        }\n   
481\t    } else {\n   482\t        let source = 
Game.getObjectById(creep.memory.sourceId);\n   483\t        if (!source || 
source.energy === 0) {\n   484\t            source = 
creep.pos.findClosestByPath(FIND_SOURCES_ACTIVE);\n   485\t            
creep.memory.sourceId = source ? source.id : null;\n   486\t        }\n   487\t 
if (source && creep.harvest(source) === ERR_NOT_IN_RANGE) creep.moveTo(source, 
{reusePath: 5});\n   488\t    }\n   489\t}\n   490\t\n   491\tfunction 
runUpgrader(creep) {\n   492\t    if (creep.memory.working && 
creep.store[RESOURCE_ENERGY] === 0) creep.memory.working = false;\n   493\t    
if (!creep.memory.working && creep.store.getFreeCapacity() === 0) 
creep.memory.working = true;\n   494\t    \n   495\t    if 
(creep.memory.working) {\n   496\t        if 
(creep.upgradeController(creep.room.controller) === ERR_NOT_IN_RANGE) 
creep.moveTo(creep.room.controller, {reusePath: 5});\n   497\t    } else {\n   
498\t        let source = Game.getObjectById(creep.memory.sourceId);\n   499\t  
if (!source || source.energy === 0) {\n   500\t            source = 
creep.pos.findClosestByPath(FIND_SOURCES_ACTIVE);\n   501\t            
creep.memory.sourceId = source ? source.id : null;\n   502\t        }\n   503\t 
if (source && creep.harvest(source) === ERR_NOT_IN_RANGE) creep.moveTo(source, 
{reusePath: 5});\n   504\t    }\n   505\t}\n   506\t\n   507\tfunction 
runBuilder(creep) {\n   508\t    if (creep.memory.working && 
creep.store[RESOURCE_ENERGY] === 0) {\n   509\t        creep.memory.working = 
false;\n   510\t        delete creep.memory.targetId;\n   511\t    }\n   512\t  
if (!creep.memory.working && creep.store.getFreeCapacity() === 0) {\n   513\t   
creep.memory.working = true;\n   514\t        delete creep.memory.targetId;\n   
515\t    }\n   516\t    \n   517\t    if (creep.memory.working) {\n   518\t     
let target = Game.getObjectById(creep.memory.targetId);\n   519\t        \n   
520\t        // 验证目标是否仍然有效\n   521\t        if (target) {\n   522\t   
// 如果是 Rampart 且已达到目标 HP，清除缓存\n   523\t            if 
(target.structureType === STRUCTURE_RAMPART && target.hits >= 100000) {\n   
524\t                target = null;\n   525\t                delete 
creep.memory.targetId;\n   526\t            }\n   527\t        }\n   528\t      
\n   529\t        if (!target) {\n   530\t            // 优先级: 工地 > 弱 
Ramparts > 升级控制器\n   531\t            const sites = 
creep.room.find(FIND_MY_CONSTRUCTION_SITES);\n   532\t            target = 
sites.find(s => s.structureType === STRUCTURE_TOWER) ||\n   533\t               
sites.find(s => s.structureType === STRUCTURE_EXTENSION) ||\n   534\t           
sites[0];\n   535\t            \n   536\t            // 如果没有工地，修复 
Ramparts (目标 100K HP)\n   537\t            if (!target) {\n   538\t           
// 找最弱的 Rampart 优先修复\n   539\t                const weakRamparts = 
creep.room.find(FIND_MY_STRUCTURES, {\n   540\t                    filter: s => 
s.structureType === STRUCTURE_RAMPART && s.hits < 100000\n   541\t              
});\n   542\t                if (weakRamparts.length > 0) {\n   543\t           
weakRamparts.sort((a, b) => a.hits - b.hits);\n   544\t                    
target = weakRamparts[0];\n   545\t                }\n   546\t            }\n   
547\t            creep.memory.targetId = target ? target.id : null;\n   548\t   
}\n   549\t        \n   550\t        if (target) {\n   551\t            // 
判断是建造还是修复\n   552\t            if (target.progressTotal !== undefined) 
{\n   553\t                // Construction site\n   554\t                if 
(creep.build(target) === ERR_NOT_IN_RANGE) creep.moveTo(target, {reusePath: 
5});\n   555\t            } else {\n   556\t                // Repair rampart\n 
557\t                if (creep.repair(target) === ERR_NOT_IN_RANGE) 
creep.moveTo(target, {reusePath: 5});\n   558\t            }\n   559\t        } 
else {\n   560\t            // 没有任务时升级控制器\n   561\t            if 
(creep.upgradeController(creep.room.controller) === ERR_NOT_IN_RANGE) 
creep.moveTo(creep.room.controller, {reusePath: 5});\n   562\t        }\n   
563\t    } else {\n   564\t        let source = 
Game.getObjectById(creep.memory.sourceId);\n   565\t        if (!source || 
source.energy === 0) {\n   566\t            source = 
creep.pos.findClosestByPath(FIND_SOURCES_ACTIVE);\n   567\t            
creep.memory.sourceId = source ? source.id : null;\n   568\t        }\n   569\t 
if (source && creep.harvest(source) === ERR_NOT_IN_RANGE) creep.moveTo(source, 
{reusePath: 5});\n   570\t    }\n   571\t}\n",
        message='571 lines read from file starting from line 1. End of file 
reached.',
        display=[],
        extras=None
    )
)
ToolCallPart(arguments_part='{"pattern": "knowledge/*"}')
StatusUpdate(
    context_usage=0.045635,
    token_usage=TokenUsage(
        input_other=1,
        output=1084,
        input_cache_read=8708,
        input_cache_creation=418
    ),
    message_id='msg_01FAmPxKYZ6Rn4Q2DEa5XzaG'
)
ToolResult(
    tool_call_id='toolu_01198brqgKBguhirnCwURa3j',
    return_value=ToolOk(
        is_error=False,
        output='knowledge/README.md\nknowledge/code_design.md\nknowledge/game_ba
sics.md\nknowledge/intel.md\nknowledge/lessons_learned.md\nknowledge/screeps-doc
s\nknowledge/sessions.log\nknowledge/stats',
        message='Found 8 matches for pattern `knowledge/*`.',
        display=[],
        extras=None
    )
)
ToolResult(
    tool_call_id='toolu_01NELqjHwjVms2yUH2HTQJce',
    return_value=ToolReturnValue(
        is_error=True,
        output='Traceback (most recent call last):\n  File "<string>", line 11, 
in <module>\nAttributeError: \'list\' object has no attribute \'items\'\n',
        message='Command failed with exit code: 1.',
        display=[
            BriefDisplayBlock(type='brief', text='Failed with exit code: 1')
        ],
        extras=None
    )
)
StepBegin(n=3)
TextPart(type='text', text='让我用更好的方式获取游戏状态：')
ToolCall(
    type='function',
    id='toolu_01XPf3rx8Xp6udgQP3rwheVK',
    function=FunctionBody(
        name='Shell',
        arguments='{"command": "source .env && curl -s 
\\"https://screeps.com/api/game/room-objects?room=E13S35&shard=shard3\\" -H 
\\"X-Token: $SCREEPS_TOKEN\\" | python3 -c \\"\\nimport json, sys\\ndata = 
json.load(sys.stdin)\\nif data.get(\'ok\') != 1:\\n    print(\'Error:\', 
data)\\n    sys.exit(1)\\n\\nobjs = data.get(\'objects\', {})\\n# Handle both 
dict and list formats\\nif isinstance(objs, list):\\n    obj_list = 
objs\\nelse:\\n    obj_list = list(objs.values())\\n\\n# Summarize by 
type\\ntypes = {}\\nfor v in obj_list:\\n    t = v.get(\'type\', \'unknown\')\\n
types[t] = types.get(t, 0) + 1\\n\\nprint(\'=== Object Types ===\')\\nfor t, c 
in sorted(types.items(), key=lambda x: -x[1]):\\n    print(f\'{t}: 
{c}\')\\n\\nprint()\\nprint(\'=== Controller ===\')\\nfor v in obj_list:\\n    
if v.get(\'type\') == \'controller\':\\n        print(f\\\\\\"Level: 
{v.get(\'level\')}, Progress: 
{v.get(\'progress\')}/{v.get(\'progressTotal\')}\\\\\\")\\n        
print(f\\\\\\"SafeMode: {v.get(\'safeMode\')}, SafeModeAvailable: 
{v.get(\'safeModeAvailable\')}\\\\\\")\\n        print(f\\\\\\"DowngradeTime: 
{v.get(\'downgradeTime\')}\\\\\\")\\n\\nprint()\\nprint(\'=== Spawn ===\')\\nfor
v in obj_list:\\n    if v.get(\'type\') == \'spawn\':\\n        
print(f\\\\\\"{v.get(\'name\')}: 
energy={v.get(\'energy\')}/{v.get(\'energyCapacity\')}, 
spawning={v.get(\'spawning\')}\\\\\\")\\n\\nprint()\\nprint(\'=== Creeps 
===\')\\nfor v in obj_list:\\n    if v.get(\'type\') == \'creep\':\\n        
body = v.get(\'body\', [])\\n        parts = [p.get(\'type\', \'?\')[0].upper() 
for p in body]\\n        owner = v.get(\'user\', \'\')\\n        
print(f\\\\\\"{v.get(\'name\')}: {\'\'.join(parts)} 
hits={v.get(\'hits\')}/{v.get(\'hitsMax\')} 
user={owner}\\\\\\")\\n\\nprint()\\nprint(\'=== Towers ===\')\\nfor v in 
obj_list:\\n    if v.get(\'type\') == \'tower\':\\n        e = v.get(\'store\', 
{}).get(\'energy\', v.get(\'energy\', 0))\\n        print(f\\\\\\"Tower at 
({v.get(\'x\')},{v.get(\'y\')}): 
energy={e}/1000\\\\\\")\\n\\nprint()\\nprint(\'=== Construction Sites 
===\')\\nfor v in obj_list:\\n    if v.get(\'type\') == \'constructionSite\':\\n
print(f\\\\\\"{v.get(\'structureType\')} at ({v.get(\'x\')},{v.get(\'y\')}): 
{v.get(\'progress\')}/{v.get(\'progressTotal\')}\\\\\\")\\n\\nprint()\\nprint(\'
=== Extensions ===\')\\ncount = 0\\nfor v in obj_list:\\n    if v.get(\'type\') 
== \'extension\':\\n        count += 1\\nprint(f\'Total extensions: 
{count}\')\\n\\nprint()\\nprint(\'=== Sources ===\')\\nfor v in obj_list:\\n    
if v.get(\'type\') == \'source\':\\n        print(f\\\\\\"Source at 
({v.get(\'x\')},{v.get(\'y\')}): 
energy={v.get(\'energy\')}/{v.get(\'energyCapacity\')}\\\\\\")\\n\\nprint()\\npr
int(\'=== Storage ===\')\\nfor v in obj_list:\\n    if v.get(\'type\') == 
\'storage\':\\n        store = v.get(\'store\', {})\\n        
print(f\\\\\\"Storage at ({v.get(\'x\')},{v.get(\'y\')}): 
{store}\\\\\\")\\n\\nprint()\\nprint(\'=== Ramparts ===\')\\nramparts = [v for v
in obj_list if v.get(\'type\') == \'rampart\']\\nfor r in ramparts:\\n    
print(f\\\\\\"Rampart at ({r.get(\'x\')},{r.get(\'y\')}): 
hits={r.get(\'hits\')}/{r.get(\'hitsMax\')}\\\\\\")\\n\\"\\n"}'
    ),
    extras=None
)
ToolCall(
    type='function',
    id='toolu_01Qp22XJVHsnVkNVpf5gu3wi',
    function=FunctionBody(
        name='ReadFile',
        arguments='{"path": "knowledge/sessions.log"}'
    ),
    extras=None
)
StatusUpdate(
    context_usage=0.10041,
    token_usage=TokenUsage(
        input_other=1,
        output=1178,
        input_cache_read=9126,
        input_cache_creation=10955
    ),
    message_id='msg_01SyQcwNEj3ssPY3fTx8kvdk'
)
ToolResult(
    tool_call_id='toolu_01Qp22XJVHsnVkNVpf5gu3wi',
    return_value=ToolOk(
        is_error=False,
        output='     1\t[Tue Jan  6 21:03:17 CST 2026] Session 
session_1_20260106_210133 started\n     2\t[2026年 1月 6日 星期二 21时26分31秒 
CST] Session session_1_20260106_212631 started\n     3\t[2026-01-07 13:52:18] 
Session session_20260107_135138 started\n     4\t[2026-01-07 15:40:50] Session 
check: E13S35 RCL3, 8 creeps, 7/10 ext (building 2), all healthy\n     
5\t[2026-01-07 15:49:15] Session check: E13S35 RCL3, 8 creeps (4h/2u/2b), 8/10 
ext (building 9th at 10%), tower operational, all healthy\n     6\t[2026-01-07 
15:52:07] Session check: E13S35 RCL3, 8 creeps (4h/2u/2b), 8/10 ext (building 
9th at 14%), tower operational, all healthy\n     7\t[2026-01-07 16:54:46] 
Session check: E13S35 RCL3, 8 creeps (4h/2u/2b), 9/10 ext (added more build 
positions for 10th), tower operational, all healthy\n     8\t[2026-01-07 
17:50:40] Session check: E13S35 RCL3 (16.4%), 8 creeps (4h/2u/2b), 9/10 ext 
(10th at 78%), tower full, all healthy\n     9\t[2026-01-07 17:59:21] Session 
check: E13S35 RCL3, 8 creeps (4h/2u/2b), 9/10 ext (10th at 93.1%), tower full, 
all healthy\n    10\t[2026-01-07 18:39:11] Session check: E13S35 RCL3 (19.2%), 
10 creeps (4h/4u/2b), 10/10 ext ✅, tower full, healthy. No pending events.\n   
11\t[2026-01-07 19:52:09] Session check: E13S35 RCL3 (22.3%), 6 creeps 
(3h/1u/2b), 10/10 ext ✅, tower operational, ramparts 201K/100K. Optimized 
spawning logic - wait for 550 energy before spawning (except emergency).\n    
12\t[2026-01-08 11:08] Session check: E13S35 RCL3 (81.9%), 7 creeps (3h/4u), 
10/10 ext ✅, tower full, ramparts 500K, no hostiles, healthy. ~24K to RCL4.\n  
13\t[2026-01-08 11:14] Session check: E13S35 RCL3 (82.4%), 7 creeps (3h/4u), 
10/10 ext ✅, tower full, ramparts 500K, no hostiles, healthy. ~23.7K to RCL4 
(ETA 1-2h).\n    14\t[2026-01-08 11:36] Session check: E13S35 RCL3 (84.2%), 7 
creeps (3h/4u), 10/10 ext ✅, tower full, ramparts 500K, no hostiles, healthy. 
~21.4K to RCL4 (ETA ~1h).\n    15\t[2026-01-08 12:08] Session check: E13S35 RCL3
(86.9%), 7 creeps (3h/4u), 10/10 ext ✅, tower 992/1000, ramparts 500K, no 
hostiles, safe mode expired but 2 available, healthy. ~17.6K to RCL4 (ETA 
~25min).\n    16\t[2026-01-08 12:14] Session check: E13S35 RCL3 (87.7%), 6→7 
creeps (3h/3→4u spawning), 10/10 ext ✅, tower full, ramparts 500K, no hostiles,
healthy. ~16.6K to RCL4 (ETA ~20-25min).\n    17\t[2026-01-08 12:27] Session 
check: E13S35 RCL3 (88.8%), 7 creeps (3h/4u), 10/10 ext ✅, tower full, ramparts
500K, no hostiles, healthy. ~15.1K to RCL4 (ETA ~15min).\n    18\t[2026-01-08 
13:34] Session check: E13S35 RCL3 (94.3%), 7 creeps (3h/4u), 10/10 ext ✅, tower
full, ramparts 500K, no hostiles, healthy. ~7.6K to RCL4 (ETA ~25-38min). Code 
ready for RCL4 auto-build.\n    19\t[2026-01-08 13:45] Session check: E13S35 
RCL3 (95.1%), 7 creeps (3h/4u), 10/10 ext ✅, tower full, ramparts 500K+, no 
hostiles, healthy. ~6.6K to RCL4 (ETA ~10-20min). Auto-build ready.\n    
20\t[2026-01-08 14:06] Session check: E13S35 RCL3 (96.8%), 7 creeps (3h/4u), 
10/10 ext ✅, tower full, no construction sites, all healthy. ~4.4K to RCL4 (ETA
~10min). Awaiting RCL4 upgrade!\n',
        message='20 lines read from file starting from line 1. End of file 
reached.',
        display=[],
        extras=None
    )
)
ToolResult(
    tool_call_id='toolu_01XPf3rx8Xp6udgQP3rwheVK',
    return_value=ToolReturnValue(
        is_error=False,
        output='=== Object Types ===\nconstructedWall: 51\nconstructionSite: 
11\nextension: 10\ncreep: 6\nsource: 2\nrampart: 2\nmineral: 1\nruin: 
1\ncontroller: 1\nspawn: 1\ntower: 1\ntombstone: 1\n\n=== Controller ===\nLevel:
4, Progress: 708/0\nSafeMode: 76628783, SafeModeAvailable: 3\nDowngradeTime: 
76695389\n\n=== Spawn ===\nSpawn1: energy=None/None, spawning=None\n\n=== Creeps
===\nharvester76656184: WWWCCMMM hits=800/800 
user=695ceeec11c0dd0012abe528\nharvester76656460: WWWCCMMM hits=800/800 
user=695ceeec11c0dd0012abe528\nharvester76656708: WWWCCMMM hits=800/800 
user=695ceeec11c0dd0012abe528\nupgrader76657022: WWWCCMMM hits=800/800 
user=695ceeec11c0dd0012abe528\nupgrader76657269: WWWCCMMM hits=800/800 
user=695ceeec11c0dd0012abe528\nbuilder76657412: WWCCMMMM hits=800/800 
user=695ceeec11c0dd0012abe528\n\n=== Towers ===\nTower at (33,15): 
energy=500/1000\n\n=== Construction Sites ===\nextension at (31,17): 
300/3000\nextension at (33,19): 0/3000\nextension at (36,16): 0/3000\nextension 
at (30,16): 0/3000\nextension at (36,18): 0/3000\nextension at (35,15): 
0/3000\nextension at (31,15): 0/3000\nextension at (29,17): 0/3000\nextension at
(35,19): 0/3000\nextension at (34,14): 0/3000\nstorage at (32,17): 
0/30000\n\n=== Extensions ===\nTotal extensions: 10\n\n=== Sources ===\nSource 
at (42,5): energy=1218/3000\nSource at (45,24): energy=2898/3000\n\n=== Storage 
===\n\n=== Ramparts ===\nRampart at (33,15): hits=611501/3000000\nRampart at 
(33,17): hits=499601/3000000\n',
        message='Command executed successfully.',
        display=[],
        extras=None
    )
)
StepBegin(n=4)
TextPart(
    type='text',
    text='太棒了！游戏状态很健康：\n\n**当前状态总结：**\n- **RCL: 4** ✅ 
(刚升级！progress 708，接近 0)\n- **Creeps: 6** (3 harvesters, 2 upgraders, 1 
builder)\n- **Extensions: 10/20** (10 已建成，10 工地)\n- **Storage: 工地** 
(0/30000)\n- **Tower: 1** (500/1000 能量)\n- **Ramparts: 2** (500K-600K HP)\n- 
**SafeMode: Active** (~76M ticks) ✅\n- **Construction Sites: 11** (10 
extensions + 1 storage)\n\nRCL4 自动建造已经触发了！当前有 11 个工地（10 个新 
Extension + 1 个 Storage）。\n\n让我检查是否需要调整 creep 配置来加速建造：'
)
ToolCall(
    type='function',
    id='toolu_01H7vEGvEiLQYUdvgZxRBHRA',
    function=FunctionBody(
        name='Shell',
        arguments='{"command": "source .env && curl -s 
\\"https://screeps.com/api/user/console\\" -H \\"X-Token: $SCREEPS_TOKEN\\" -H 
\\"Content-Type: application/json\\" -X POST -d 
\'{\\"expression\\":\\"JSON.stringify({time:Game.time,energy:Game.spawns.Spawn1.
room.energyAvailable,capacity:Game.spawns.Spawn1.room.energyCapacityAvailable,cr
eeps:Object.keys(Game.creeps).length,sites:Game.spawns.Spawn1.room.find(FIND_MY_
CONSTRUCTION_SITES).length,spawning:Game.spawns.Spawn1.spawning?Game.spawns.Spaw
n1.spawning.name:null})\\",\\"shard\\":\\"shard3\\"}\'"}'
    ),
    extras=None
)
StatusUpdate(
    context_usage=0.117415,
    token_usage=TokenUsage(
        input_other=1,
        output=491,
        input_cache_read=20081,
        input_cache_creation=3401
    ),
    message_id='msg_011bQUhtPGtKi87yqyvs6nC3'
)
ToolResult(
    tool_call_id='toolu_01H7vEGvEiLQYUdvgZxRBHRA',
    return_value=ToolReturnValue(
        is_error=False,
        output='{"ok":1,"result":{"ok":1,"n":1},"ops":[{"user":"695ceeec11c0dd00
12abe528","expression":"JSON.stringify({time:Game.time,energy:Game.spawns.Spawn1
.room.energyAvailable,capacity:Game.spawns.Spawn1.room.energyCapacityAvailable,c
reeps:Object.keys(Game.creeps).length,sites:Game.spawns.Spawn1.room.find(FIND_MY
_CONSTRUCTION_SITES).length,spawning:Game.spawns.Spawn1.spawning?Game.spawns.Spa
wn1.spawning.name:null})","shard":"shard3","_id":"695f5566f034190012a231c4"}],"i
nsertedCount":1,"insertedIds":["695f5566f034190012a231c4"]}',
        message='Command executed successfully.',
        display=[],
        extras=None
    )
)
StepBegin(n=5)
ToolCall(
    type='function',
    id='toolu_0138fanXxMYunE2nGj8zYmoV',
    function=FunctionBody(
        name='Shell',
        arguments='{"command": "sleep 2 && source .env && curl -s 
\\"https://screeps.com/api/user/memory?path=&shard=shard3\\" -H \\"X-Token: 
$SCREEPS_TOKEN\\" | python3 -c \\"\\nimport json, sys, gzip, base64\\ndata = 
json.load(sys.stdin)\\nif data.get(\'ok\') != 1:\\n    print(\'Error:\', 
data)\\n    sys.exit(1)\\nmem_str = data.get(\'data\', \'\')\\nif 
mem_str.startswith(\'gz:\'):\\n    mem_bytes = base64.b64decode(mem_str[3:])\\n 
mem_str = gzip.decompress(mem_bytes).decode()\\nmem = 
json.loads(mem_str)\\nprint(\'=== Memory ===\')\\nprint(f\\\\\\"Creeps in 
memory: {len(mem.get(\'creeps\', {}))}\\\\\\")\\nprint(f\\\\\\"Events mem: 
{mem.get(\'events\', {})}\\\\\\")\\n\\""}'
    ),
    extras=None
)
StatusUpdate(
    context_usage=0.121025,
    token_usage=TokenUsage(
        input_other=1,
        output=285,
        input_cache_read=23482,
        input_cache_creation=722
    ),
    message_id='msg_016jdUqLBezxNNbDfDtbtJAx'
)
ToolResult(
    tool_call_id='toolu_0138fanXxMYunE2nGj8zYmoV',
    return_value=ToolReturnValue(
        is_error=False,
        output="=== Memory ===\nCreeps in memory: 6\nEvents mem: 
{'hostileDetected': None, 'lastLevel': 4, 'downgradeWarned': False, 
'extensionCount': 10, 'towerCount': 1, 'storageCount': 0, 'downgradeLevel': 
None, 'lastCreeps': ['harvester76656184', 'harvester76656460', 
'harvester76656708', 'upgrader76657022', 'upgrader76657269', 'builder76657412'],
'creepRoles': {'harvester76656184': 'harvester', 'harvester76656460': 
'harvester', 'harvester76656708': 'harvester', 'upgrader76657022': 'upgrader', 
'upgrader76657269': 'upgrader', 'builder76657412': 'builder'}, 'creepHits': 
{'harvester76656184': 800, 'harvester76656460': 800, 'harvester76656708': 800, 
'upgrader76657022': 800, 'upgrader76657269': 800, 'builder76657412': 800}, 
'spawnAttacked': False, 'agingWarned': {}}\n",
        message='Command executed successfully.',
        display=[],
        extras=None
    )
)
StepBegin(n=6)
TextPart(
    type='text',
    text='现在让我检查当前的 creep 配置目标：\n\n根据 `main.js` 中的 
`getCreepTargets` 函数：\n- RCL4: `{ harvester: 3, builder: 3, upgrader: 3 }` 
(有工地时 builder: 3)\n\n当前有 6 个 creeps (3h/2u/1b)，目标是 9 个 
(3h/3u/3b)。\n\nSpawn 应该会自动孵化更多 builders 和 
upgraders。系统工作正常！\n\n让我更新 session log 和 AGENTS.md，然后提交：'
)
ToolCall(
    type='function',
    id='toolu_014o3H81JVg5QowmcxUqYHYG',
    function=FunctionBody(
        name='Shell',
        arguments='{"command": "echo \\"[2026-01-08 14:57] Session check: E13S35
RCL4 ✅, 6 creeps (3h/2u/1b) → target 9 (3h/3b/3u), 10/20 ext (10 sites 
building), storage site building, tower 500, ramparts 500K-600K, no hostiles, 
safe mode active. Auto-spawning builders for construction.\\" >> 
knowledge/sessions.log"}'
    ),
    extras=None
)
ToolCall(
    type='function',
    id='toolu_01Nh6b8gfmxLXJD9SPanLMMJ',
    function=FunctionBody(
        name='StrReplaceFile',
        arguments='{"path": "/Users/moonshot/dev/infinite-screeps/AGENTS.md"'
    ),
    extras=None
)
ToolResult(
    tool_call_id='toolu_014o3H81JVg5QowmcxUqYHYG',
    return_value=ToolReturnValue(
        is_error=False,
        output='',
        message='Command executed successfully.',
        display=[],
        extras=None
    )
)
ToolCallPart(
    arguments_part=', "edit": {"old":"## Current Status\\n\\n- Room: E13S35 
(shard3)\\n- **RCL: 4** 🎉🎉🎉 刚刚升级！\\n- Extensions: 10/20 (已建成 10，工地
10)\\n- Tower: 1 at (33,15), energy 600 ✅\\n- Ramparts: 2 (Spawn & Tower) ~500K
HP ✅\\n- Creeps: 8 (3 harvesters, 3 upgraders, 1 builder) ✅\\n- Construction 
Sites: 11 (10 extensions + 1 storage)\\n- SafeMode: Active (~76M ticks) ✅\\n- 
SafeModeAvailable: 3 ✅\\n- **Next goal:**\\n  - 建造 10 个新 Extensions (RCL4 
解锁 20 Extensions)\\n  - 建造 Storage\\n  - 升级到 RCL5 (需要 370,000 能量)\\n-
RCL4 解锁内容:\\n  - 20 Extensions (max)\\n  - Storage (1 max)\\n- Last updated:
2026-01-08 14:51","new":"## Current Status\\n\\n- Room: E13S35 (shard3)\\n- 
**RCL: 4** 🎉\\n- Extensions: 10/20 (10 built, 10 under construction)\\n- 
Storage: under construction\\n- Tower: 1 at (33,15), energy 500 ✅\\n- Ramparts:
2 (Spawn & Tower) ~500K-600K HP ✅\\n- Creeps: 6 (3h/2u/1b) → spawning to 9 
(3h/3b/3u)\\n- Construction Sites: 11 (10 extensions + 1 storage)\\n- SafeMode: 
Active (~76M ticks) ✅\\n- SafeModeAvailable: 3 ✅\\n- **Current tasks:**\\n  - 
Building 10 new Extensions (RCL4 unlocks 20)\\n  - Building Storage\\n- **Next 
goal:**\\n  - Complete all RCL4 buildings\\n  - Upgrade to RCL5 (requires 
370,000 energy)\\n- RCL4 unlocks:\\n  - 20 Extensions (max)\\n  - Storage (1 
max)\\n- Last updated: 2026-01-08 14:57"}}'
)
StatusUpdate(
    context_usage=0.12407,
    token_usage=TokenUsage(
        input_other=1,
        output=1037,
        input_cache_read=24204,
        input_cache_creation=609
    ),
    message_id='msg_01Eg6m5CWFzmbT34SFDu5wpJ'
)
ToolResult(
    tool_call_id='toolu_01Nh6b8gfmxLXJD9SPanLMMJ',
    return_value=ToolReturnValue(
        is_error=False,
        output='',
        message='File successfully edited. Applied 1 edit(s) with 1 total 
replacement(s).',
        display=[
            DiffDisplayBlock(
                type='diff',
                path='/Users/moonshot/dev/infinite-screeps/AGENTS.md',
                old_text='## Current Status\n\n- Room: E13S35 (shard3)\n- **RCL:
4** 🎉🎉🎉 刚刚升级！\n- Extensions: 10/20 (已建成 10，工地 10)\n- Tower: 1 at 
(33,15), energy 600 ✅\n- Ramparts: 2 (Spawn & Tower) ~500K HP ✅\n- Creeps: 8 
(3 harvesters, 3 upgraders, 1 builder) ✅\n- Construction Sites: 11 (10 
extensions + 1 storage)\n- SafeMode: Active (~76M ticks) ✅\n- 
SafeModeAvailable: 3 ✅\n- **Next goal:**\n  - 建造 10 个新 Extensions (RCL4 
解锁 20 Extensions)\n  - 建造 Storage\n  - 升级到 RCL5 (需要 370,000 能量)\n- 
RCL4 解锁内容:\n  - 20 Extensions (max)\n  - Storage (1 max)\n- Last updated: 
2026-01-08 14:51',
                new_text='## Current Status\n\n- Room: E13S35 (shard3)\n- **RCL:
4** 🎉\n- Extensions: 10/20 (10 built, 10 under construction)\n- Storage: under 
construction\n- Tower: 1 at (33,15), energy 500 ✅\n- Ramparts: 2 (Spawn & 
Tower) ~500K-600K HP ✅\n- Creeps: 6 (3h/2u/1b) → spawning to 9 (3h/3b/3u)\n- 
Construction Sites: 11 (10 extensions + 1 storage)\n- SafeMode: Active (~76M 
ticks) ✅\n- SafeModeAvailable: 3 ✅\n- **Current tasks:**\n  - Building 10 new 
Extensions (RCL4 unlocks 20)\n  - Building Storage\n- **Next goal:**\n  - 
Complete all RCL4 buildings\n  - Upgrade to RCL5 (requires 370,000 energy)\n- 
RCL4 unlocks:\n  - 20 Extensions (max)\n  - Storage (1 max)\n- Last updated: 
2026-01-08 14:57'
            )
        ],
        extras=None
    )
)
StepBegin(n=7)
ToolCall(
    type='function',
    id='toolu_01MEL5d7k7UvqEikNfoFJFDU',
    function=FunctionBody(
        name='Shell',
        arguments='{"command": "cd /Users/moonshot/dev/infinite-screeps && git 
add -A && git commit -m \\"[status] RCL4 session check - 10 ext sites + storage 
building, spawning builders\\""}'
    ),
    extras=None
)
StatusUpdate(
    context_usage=0.130375,
    token_usage=TokenUsage(
        input_other=1,
        output=97,
        input_cache_read=24813,
        input_cache_creation=1261
    ),
    message_id='msg_01CWqqtziTQuiMtnEVYCPB48'
)
ToolResult(
    tool_call_id='toolu_01MEL5d7k7UvqEikNfoFJFDU',
    return_value=ToolReturnValue(
        is_error=False,
        output='[main 30a9c3c] [status] RCL4 session check - 10 ext sites + 
storage building, spawning builders\n 6 files changed, 1043 insertions(+), 10 
deletions(-)\n create mode 100644 events/processed_1767855404.json\n create mode
100644 logs/session_1_20260108_145646.log\n',
        message='Command executed successfully.',
        display=[],
        extras=None
    )
)
StepBegin(n=8)
TextPart(
    type='text',
    text='**Session 完成！**\n\n## 状态总结\n\n| 项目 | 状态 
|\n|------|------|\n| RCL | **4** ✅ (刚升级) |\n| Creeps | 6/9 (自动孵化中) 
|\n| Extensions | 10/20 (10 工地进行中) |\n| Storage | 工地进行中 |\n| Tower | 
500/1000 能量 |\n| Ramparts | 500K-600K HP |\n| 威胁 | 无 |\n| SafeMode | 活跃 
(~76M ticks) |\n\n**自动化运作正常：**\n- RCL4 升级已触发自动建造 10 个新 
Extension + 1 个 Storage\n- Spawn 正在自动孵化更多 builders (当前 1 → 目标 3)\n-
Tower 自动修复 Ramparts 到 100K HP\n\n无需人工干预，系统正常运行中。'
)
StatusUpdate(
    context_usage=0.13144,
    token_usage=TokenUsage(
        input_other=1,
        output=268,
        input_cache_read=26074,
        input_cache_creation=213
    ),
    message_id='msg_01HzGKAJKsCUihnUxra3bjXE'
)
