# Screeps Eternal Agent

你是 Screeps 游戏的永恒 AI Agent。

## ⚠️ 首先检查待处理事件

**立即检查 `events/pending.json`**，如果存在且有内容：
- `critical` 优先级 → 立即处理，可能是攻击/Spawn被毁
- `high` 优先级 → 优先处理，可能是 Creep 全灭
- 处理完成后删除该文件

## 任务流程

1. **检查事件** - 读取 `events/pending.json`
2. **阅读 AGENTS.md** - 了解使命和约束
3. **遍历文件** - 理解当前状态，读取 knowledge/ 经验
4. **检查游戏** - 调用 Screeps API
5. **采取行动** - 修改代码，上传到游戏
6. **固化知识** - 写入 knowledge/
7. **Git 提交** - `git add -A && git commit -m " message"`

## 凭证

- Token: `.env` 文件中的 `SCREEPS_TOKEN`
- 用户: payyy
- 房间: E13S35 (shard3)

## 约束

- 所有操作限制在 `/Users/moonshot/dev/infinite-screeps/` 目录
- 每次修改后必须 git commit
- 免费玩家: CPU 20, shard3, 最多1个房间

**现在开始工作。**
TurnBegin(
    user_input='# Screeps Eternal Agent\n\n你是 Screeps 游戏的永恒 AI 
Agent。\n\n## ⚠️ 首先检查待处理事件\n\n**立即检查 
`events/pending.json`**，如果存在且有内容：\n- `critical` 优先级 → 
立即处理，可能是攻击/Spawn被毁\n- `high` 优先级 → 优先处理，可能是 Creep 全灭\n-
处理完成后删除该文件\n\n## 任务流程\n\n1. **检查事件** - 读取 
`events/pending.json`\n2. **阅读 AGENTS.md** - 了解使命和约束\n3. **遍历文件** -
理解当前状态，读取 knowledge/ 经验\n4. **检查游戏** - 调用 Screeps API\n5. 
**采取行动** - 修改代码，上传到游戏\n6. **固化知识** - 写入 knowledge/\n7. **Git
提交** - `git add -A && git commit -m "[type] message"`\n\n## 凭证\n\n- Token: 
`.env` 文件中的 `SCREEPS_TOKEN`\n- 用户: payyy\n- 房间: E13S35 (shard3)\n\n## 
约束\n\n- 所有操作限制在 `/Users/moonshot/dev/infinite-screeps/` 目录\n- 
每次修改后必须 git commit\n- 免费玩家: CPU 20, shard3, 
最多1个房间\n\n**现在开始工作。**'
)
StepBegin(n=1)
ToolCall(
    type='function',
    id='toolu_011DXH8akghpZ1oeXNFcyfGU',
    function=FunctionBody(
        name='ReadFile',
        arguments='{"path": "events/pending.json"}'
    ),
    extras=None
)
ToolCall(
    type='function',
    id='toolu_01GWZ78MQXpUtfJpV9hc9MRf',
    function=FunctionBody(name='Shell', arguments=''),
    extras=None
)
ToolResult(
    tool_call_id='toolu_011DXH8akghpZ1oeXNFcyfGU',
    return_value=ToolError(
        is_error=True,
        output='',
        message='`events/pending.json` does not exist.',
        display=[BriefDisplayBlock(type='brief', text='File not found')],
        extras=None
    )
)
ToolCallPart(arguments_part='{"command": "cat .env | grep SCREEPS_TOKEN"}')
StatusUpdate(
    context_usage=0.04404,
    token_usage=TokenUsage(
        input_other=3,
        output=99,
        input_cache_read=0,
        input_cache_creation=8805
    ),
    message_id='msg_01HvxYKUmmH9AZBQrDcsZsob'
)
ToolResult(
    tool_call_id='toolu_01GWZ78MQXpUtfJpV9hc9MRf',
    return_value=ToolReturnValue(
        is_error=False,
        output='SCREEPS_TOKEN=9532a4c3-b950-4798-bb97-e7d441ef41e2\n',
        message='Command executed successfully.',
        display=[],
        extras=None
    )
)
StepBegin(n=2)
TextPart(type='text', text='没有待处理事件。让我检查游戏状态和当前代码：')
ToolCall(
    type='function',
    id='toolu_01SL2NyVCyDjSD8dY18yRifT',
    function=FunctionBody(
        name='Shell',
        arguments='{"command": "curl -s 
\\"https://screeps.com/api/game/room-terrain?room=E13S35&shard=shard3&encoded=1\
\" -H \\"X-Token: 9532a4c3-b950-4798-bb97-e7d441ef41e2\\" | head -c 500"}'
    ),
    extras=None
)
ToolCall(
    type='function',
    id='toolu_01V886y8obBAgmv4uhaf6KZ1',
    function=FunctionBody(
        name='Shell',
        arguments='{"command": "curl -s 
\\"https://screeps.com/api/user/memory?shard=shard3\\" -H \\"X-Token: 
9532a4c3-b950-4798-bb97-e7d441ef41e2\\" | head -c 2000"}'
    ),
    extras=None
)
ToolCall(
    type='function',
    id='toolu_012MtZ3hjJXK2q3mtGucRzdG',
    function=FunctionBody(name='Shell', arguments=''),
    extras=None
)
ToolResult(
    tool_call_id='toolu_01SL2NyVCyDjSD8dY18yRifT',
    return_value=ToolReturnValue(
        is_error=False,
        output='{"ok":1,"terrain":[{"_id":"5bbcadb59099fc012e637abf","room":"E13
S35","terrain":"1111110001111111111111111111111111111111111111111111001100000000
11100111100001111000000000011100001110000000000000000000111000000000000000000000
00000110000000000000000000212000000000002200000000000001100000000000000000022211
00000011022220000000000001100000000000000000002221100001110022000000111110111000
00000000000000000001110001110000000001111111111000000000000000000000011100011100
000000001111111110000000011000011000',
        message='Command executed successfully.',
        display=[],
        extras=None
    )
)
ToolCallPart(
    arguments_part='{"command": "curl -s 
\\"https://screeps.com/api/user/console\\" -H \\"X-Token: 
9532a4c3-b950-4798-bb97-e7d441ef41e2\\" -H \\"Content-Type: application/json\\" 
-d \'{\\"expression\\":\\"JSON.stringify({tick:Game'
)
ToolResult(
    tool_call_id='toolu_01V886y8obBAgmv4uhaf6KZ1',
    return_value=ToolReturnValue(
        is_error=False,
        output='{"ok":1,"data":"gz:H4sIAAAAAAAEA81YW2vbSBT+L3o2y9wvfluawC4UCm1hW
UooM6MzjqljBVlOWkL++54ZWbZkO41jObB6MT4zOvOd+zd6KkINcL8qpk/FrasfYNVArZWSWludhHW1g
GK6Wysmxapa1wH+LlEsvQ+u9NISa2MglIHi2gWKux6r+sd8OSumTb2GSdG4egZNfklZCQRMKLlwTBpNI
o2c4XGT4vtd9YDHPRUlAkm/P4spl5PiVzGlZoJgqjs89ZryL1wWz6h1fofbE15LNW64d80tbuCWUWOMN
qhy7x18ya/ni3JjpZWiZ+Vm5SQbyWs2Rsklt6bkgVppuIsU/71kI29ttAd492xUOxsJlSo9Eh8hBOeM0
fQctXkQW0Ml71m9XXu73dEtVhjcY2ETLJuEwduLwNAihRs2UROUSMFPgM8M+b/A7yedJprhw8VRE3pZZ
wQxPQPOzrrx3u/Dl0TTBJ+/YMD6fla7Td0Yyfsh6JZOSqBBc/idCW3dM/FKBmnc0GWQYpIeL/oOYuoVR
nHW83+3dBL6Qdn/Dv1p6a97Bc2pMG0J5zQ6KQ76Qpa0TfpoHZNcx5y+FoZdIXNMpeTn3J7aBpVbFHYpb
FPpeb1EMMN6IXpLiVw8v3aGCcqw1SYDjpb4tpG2A0nJngXbtROz7BkH1apxTZ7M2zHHtCUYj3C/LqbsD
5xxXBFO8GHcaJRvZjlOwgU8wAKHJ9ZGXc1qWKEiKogwqBeXlq3i22rVzBdwBQ2EBnCiL9eLBb7sVs3HV
gEWV1k9LnPp/+PqZdq0SXv42cByNa+WH6r1Eqc1xRRpqkeou//Jgqp2M9gIEPlW10b97rwPG+zfdlwju
THzkMOZPRnuyhNtX5bGxODN3HcnRVfvuRWkRrYnSt1hT5TKbKgq5efegZZixG82UfiMvCnHbhv4rTVDN
tWbCzqzkY6f7Ktvp/bO7oP1PBYH6z3d7czp6T7wwnTrGNQ8WM3tcivaX80tqL/aPzWXce/UgTeyw/rew
NzMKfzXfJOeh4xUpfzvndD6LEsHultvHZFnL4k9La13snRgeR5zh+LskENx9sSB6uyCLB0AbI1HgKnQ7
93j8s+mceFHr77cDPlzV3NPqSGE6s675mOFrPrbU4/8GptIclPPZzOokf9mJ34v51BON67CoHVVn978d
Z9I/dX1l6+fP/17fYWrrj297hh6lAy4DgQId0IGRjh1qbN2+z49LvNRs2oJKG7p/ddWbz6+eL55ngxAa
osz8SjIzudnoKQiltyXngldEgcCrxXjUErxkivPRynARMZEoAE0C5RFZhJLGeFLlubxUV9uk+ztzhSea
El90DR67xUxgqlRMLU1OIAuDtMI7rjnUSIdpRJ8DHYcTGTu7wATmwcxREUTDKgShGduHExFkC0e9eaI1
BSUlxQw5o5GDQqvMGkgnp+amEHvUECclEwLrCBhJUG8xI0rc80U3rUv7Uu8v7YXfm6Aukggk4QRviTs8
i2Tl5aWXFkNzCsbPPUxfXo5H6XSBAnnUV+OaEbcEbAAUTFHTInMldhxIVdCIXW4OEwtiZNRSQCqlccZp
MI4b1KDnPviMIUgWhH88uYt8Syl57gJhNPhpdZ+fjPinEYKKsrgONZSxCYvRzlT2nfgHJzRCEJJwYiQx
glVinEhl1pcvrGzKKMnCru7IowGFRlJd5jzyxx72+VbJgsWv4viV6fITakMCO4TnRyBkpqXxs+IZsQsB
fymTJBzRJCMOebHOVNY/g6UgykZRKko0rhSKi0dC+Nau1DqHXgmfiJ1yuGlxTNNSET69vY5efP8H+0/O
ia7GAAA"}',
        message='Command executed successfully.',
        display=[],
        extras=None
    )
)
ToolCallPart(
    arguments_part='.time,rcl:Game.rooms.E13S35.controller.level,progress:Game.r
ooms.E13S35.controller.progress,progressTotal:Game.rooms.E13S35.controller.progr
essTotal,creeps:Object.keys(Game.creeps).length,spawns:Object.keys(Game.spawns).
length,sites:Object.keys(Game.constructionSites).length,energy:Game.rooms.E13S35
.energyAvailable,energyCap:Game.rooms.E13S35.energyCapacityAvailable})\\",\\"sha
rd\\":\\"shard3\\"}\'"}'
)
ToolCall(
    type='function',
    id='toolu_0174V5qN2zeXCbb4u5WrA5Tn',
    function=FunctionBody(
        name='ReadFile',
        arguments='{"path": "screeps/main.js"}'
    ),
    extras=None
)
ToolCall(
    type='function',
    id='toolu_017TVw4jytnzi1a3RyVTrtMU',
    function=FunctionBody(
        name='Glob',
        arguments='{"pattern": "knowledge/*.md"}'
    ),
    extras=None
)
StatusUpdate(
    context_usage=0.045145,
    token_usage=TokenUsage(
        input_other=1,
        output=571,
        input_cache_read=8805,
        input_cache_creation=223
    ),
    message_id='msg_01F4pNinSo2zyYLTsf4W2bnj'
)
ToolResult(
    tool_call_id='toolu_017TVw4jytnzi1a3RyVTrtMU',
    return_value=ToolOk(
        is_error=False,
        output='knowledge/README.md\nknowledge/code_design.md\nknowledge/game_ba
sics.md\nknowledge/intel.md\nknowledge/lessons_learned.md',
        message='Found 5 matches for pattern `knowledge/*.md`.',
        display=[],
        extras=None
    )
)
ToolResult(
    tool_call_id='toolu_0174V5qN2zeXCbb4u5WrA5Tn',
    return_value=ToolOk(
        is_error=False,
        output="     1\t/**\n     2\t * Screeps Eternal - Event-Driven v4\n     
3\t * \n     4\t * 事件系统: 输出到控制台供 watcher 监听\n     5\t * 战斗日志: 
使用 room.getEventLog() 记录攻击详情到 Memory\n     6\t */\n     7\t\n     8\t//
========== 事件系统 ==========\n     9\t\n    10\tfunction emitEvent(type, value
= '') {\n    11\t    const msg = value ? `[EVENT:${type}:${value}]` : 
`[EVENT:${type}]`;\n    12\t    console.log(msg);\n    13\t}\n    14\t\n    
15\t// 记录战斗日志 (只在检测到战斗时调用)\n    16\tfunction 
recordCombatLog(room, trigger) {\n    17\t    const events = 
room.getEventLog();\n    18\t    \n    19\t    // 筛选攻击和摧毁事件\n    20\t  
const combatEvents = events.filter(e => \n    21\t        e.event === 
EVENT_ATTACK || \n    22\t        e.event === EVENT_OBJECT_DESTROYED\n    23\t  
);\n    24\t    \n    25\t    if (combatEvents.length === 0) return;\n    26\t  
\n    27\t    // 构建战斗日志\n    28\t    const log = {\n    29\t        time: 
Game.time,\n    30\t        trigger: trigger,\n    31\t        events: 
combatEvents.map(e => {\n    32\t            const attacker = 
Game.getObjectById(e.objectId);\n    33\t            const target = 
e.data.targetId ? Game.getObjectById(e.data.targetId) : null;\n    34\t         
\n    35\t            return {\n    36\t                type: e.event === 
EVENT_ATTACK ? 'ATTACK' : 'DESTROYED',\n    37\t                attackerId: 
e.objectId,\n    38\t                attackerOwner: attacker ? (attacker.owner ?
attacker.owner.username : 'unknown') : 'gone',\n    39\t                
targetId: e.data.targetId,\n    40\t                targetType: e.data.type || 
(target ? target.structureType || 'creep' : 'unknown'),\n    41\t               
damage: e.data.damage,\n    42\t                attackType: e.data.attackType\n 
43\t            };\n    44\t        })\n    45\t    };\n    46\t    \n    47\t  
// 保存到 Memory (保留最近 20 条)\n    48\t    Memory.combatLog = 
Memory.combatLog || [];\n    49\t    Memory.combatLog.unshift(log);\n    50\t   
if (Memory.combatLog.length > 20) {\n    51\t        Memory.combatLog = 
Memory.combatLog.slice(0, 20);\n    52\t    }\n    53\t}\n    54\t\n    
55\tfunction checkEvents(room, spawn) {\n    56\t    const mem = Memory.events 
|| {};\n    57\t    const controller = room.controller;\n    58\t    let 
combatDetected = false;\n    59\t    let combatTrigger = '';\n    60\t    \n    
61\t    // ===== 敌人检测 =====\n    62\t    const hostiles = 
room.find(FIND_HOSTILE_CREEPS);\n    63\t    if (hostiles.length > 0) {\n    
64\t        if (!mem.hostileDetected) {\n    65\t            // 新敌人出现\n    
66\t            const info = hostiles.map(h => 
`${h.owner.username}(${h.body.length}parts)`).join(',');\n    67\t            
emitEvent('HOSTILE', `${hostiles.length}:${info}`);\n    68\t            
combatDetected = true;\n    69\t            combatTrigger = 
'hostile_detected';\n    70\t        }\n    71\t        mem.hostileDetected = 
Game.time;\n    72\t    } else {\n    73\t        mem.hostileDetected = null;\n 
74\t    }\n    75\t    \n    76\t    // ===== Spawn 被攻击 =====\n    77\t    if
(spawn.hits < spawn.hitsMax) {\n    78\t        if (!mem.spawnAttacked) {\n    
79\t            emitEvent('SPAWN_ATTACKED', `${spawn.hits}/${spawn.hitsMax}`);\n
80\t            mem.spawnAttacked = true;\n    81\t            combatDetected = 
true;\n    82\t            combatTrigger = 'spawn_attacked';\n    83\t        
}\n    84\t    } else {\n    85\t        mem.spawnAttacked = false;\n    86\t   
}\n    87\t    \n    88\t    // ===== RCL 升级 =====\n    89\t    if 
(mem.lastLevel !== undefined && controller.level > mem.lastLevel) {\n    90\t   
emitEvent('RCL_UP', controller.level);\n    91\t    }\n    92\t    mem.lastLevel
= controller.level;\n    93\t    \n    94\t    // ===== 控制器降级警告 (分级) 
=====\n    95\t    const ttd = controller.ticksToDowngrade;\n    96\t    if (ttd
< 1000 && mem.downgradeLevel !== 'CRITICAL') {\n    97\t        
emitEvent('DOWNGRADE_CRITICAL', ttd);\n    98\t        mem.downgradeLevel = 
'CRITICAL';\n    99\t    } else if (ttd < 5000 && ttd >= 1000 && 
mem.downgradeLevel !== 'URGENT') {\n   100\t        
emitEvent('DOWNGRADE_URGENT', ttd);\n   101\t        mem.downgradeLevel = 
'URGENT';\n   102\t    } else if (ttd < 20000 && ttd >= 5000 && 
mem.downgradeLevel !== 'WARNING') {\n   103\t        
emitEvent('DOWNGRADE_WARNING', ttd);\n   104\t        mem.downgradeLevel = 
'WARNING';\n   105\t    } else if (ttd >= 20000) {\n   106\t        
mem.downgradeLevel = null;\n   107\t    }\n   108\t    \n   109\t    // ===== 
Creep 死亡检测 =====\n   110\t    const currentCreeps = 
Object.keys(Game.creeps);\n   111\t    const lastCreeps = mem.lastCreeps || 
[];\n   112\t    \n   113\t    for (const name of lastCreeps) {\n   114\t       
if (!Game.creeps[name]) {\n   115\t            const role = mem.creepRoles ? 
mem.creepRoles[name] : 'unknown';\n   116\t            emitEvent('CREEP_DIED', 
`${role}:${name}`);\n   117\t            combatDetected = true;\n   118\t       
combatTrigger = `creep_died:${role}`;\n   119\t        }\n   120\t    }\n   
121\t    \n   122\t    mem.lastCreeps = currentCreeps;\n   123\t    
mem.creepRoles = mem.creepRoles || {};\n   124\t    for (const name in 
Game.creeps) {\n   125\t        mem.creepRoles[name] = 
Game.creeps[name].memory.role;\n   126\t    }\n   127\t    for (const name in 
mem.creepRoles) {\n   128\t        if (!Game.creeps[name]) delete 
mem.creepRoles[name];\n   129\t    }\n   130\t    \n   131\t    if 
(currentCreeps.length === 0 && lastCreeps.length > 0) {\n   132\t        
emitEvent('NO_CREEPS');\n   133\t    }\n   134\t    \n   135\t    // ===== Creep
受伤检测 =====\n   136\t    mem.creepHits = mem.creepHits || {};\n   137\t    
for (const name in Game.creeps) {\n   138\t        const creep = 
Game.creeps[name];\n   139\t        const lastHits = mem.creepHits[name] !== 
undefined ? mem.creepHits[name] : creep.hitsMax;\n   140\t        \n   141\t    
if (creep.hits < lastHits) {\n   142\t            const role = 
creep.memory.role;\n   143\t            const hpPercent = Math.round(creep.hits 
/ creep.hitsMax * 100);\n   144\t            emitEvent('CREEP_HURT', 
`${role}:${name}:${hpPercent}%`);\n   145\t            combatDetected = true;\n 
146\t            combatTrigger = `creep_hurt:${role}`;\n   147\t        }\n   
148\t        mem.creepHits[name] = creep.hits;\n   149\t    }\n   150\t    for 
(const name in mem.creepHits) {\n   151\t        if (!Game.creeps[name]) delete 
mem.creepHits[name];\n   152\t    }\n   153\t    \n   154\t    // ===== Creep 
寿命警告 =====\n   155\t    mem.agingWarned = mem.agingWarned || {};\n   156\t  
for (const name in Game.creeps) {\n   157\t        const creep = 
Game.creeps[name];\n   158\t        if (creep.ticksToLive === undefined) 
continue; // spawning\n   159\t        const spawnTime = creep.body.length * 3; 
// CREEP_SPAWN_TIME = 3\n   160\t        const threshold = spawnTime * 2; // 
给余量让替代 creep 孵化\n   161\t        if (creep.ticksToLive <= threshold && 
!mem.agingWarned[name]) {\n   162\t            const role = creep.memory.role;\n
163\t            emitEvent('CREEP_AGING', 
`${role}:${name}:${creep.ticksToLive}t`);\n   164\t            
mem.agingWarned[name] = true;\n   165\t        }\n   166\t    }\n   167\t    for
(const name in mem.agingWarned) {\n   168\t        if (!Game.creeps[name]) 
delete mem.agingWarned[name];\n   169\t    }\n   170\t    \n   171\t    // =====
低能量 =====\n   172\t    if (room.energyAvailable < 200 && currentCreeps.length
=== 0) {\n   173\t        emitEvent('LOW_ENERGY', room.energyAvailable);\n   
174\t    }\n   175\t    \n   176\t    // ===== 记录战斗日志 (只在检测到战斗时) 
=====\n   177\t    if (combatDetected) {\n   178\t        recordCombatLog(room, 
combatTrigger);\n   179\t    }\n   180\t    \n   181\t    // ===== 建筑完成检测 
(每 10 ticks) =====\n   182\t    if (Game.time % 10 === 0) {\n   183\t        
const structures = room.find(FIND_MY_STRUCTURES);\n   184\t        const counts 
= {};\n   185\t        for (const s of structures) {\n   186\t            
counts[s.structureType] = (counts[s.structureType] || 0) + 1;\n   187\t        
}\n   188\t        \n   189\t        if (mem.extensionCount !== undefined && 
(counts.extension || 0) > mem.extensionCount) {\n   190\t            
emitEvent('EXTENSION_BUILT', counts.extension);\n   191\t        }\n   192\t    
mem.extensionCount = counts.extension || 0;\n   193\t        \n   194\t        
if (mem.towerCount !== undefined && (counts.tower || 0) > mem.towerCount) {\n   
195\t            emitEvent('TOWER_BUILT', counts.tower);\n   196\t        }\n   
197\t        mem.towerCount = counts.tower || 0;\n   198\t        \n   199\t    
if (mem.storageCount !== undefined && (counts.storage || 0) > mem.storageCount) 
{\n   200\t            emitEvent('STORAGE_BUILT', counts.storage);\n   201\t    
}\n   202\t        mem.storageCount = counts.storage || 0;\n   203\t    }\n   
204\t    \n   205\t    Memory.events = mem;\n   206\t}\n   207\t\n   208\t// 
========== 配置 ==========\n   209\t\n   210\tfunction getCreepTargets(room) {\n
211\t    const level = room.controller.level;\n   212\t    const sites = 
room.find(FIND_MY_CONSTRUCTION_SITES).length;\n   213\t    \n   214\t    // 2 
Sources 最多产 20 energy/tick\n   215\t    // 3 Harvester (9 WORK) = 18 
energy/tick, 足够\n   216\t    if (level <= 2) {\n   217\t        return { 
harvester: 4, builder: sites > 0 ? 3 : 1, upgrader: 3 };\n   218\t    } else if 
(level === 3) {\n   219\t        // RCL3: 优先升级到 RCL4\n   220\t        
return { harvester: 3, builder: sites > 0 ? 2 : 0, upgrader: 4 };\n   221\t    }
else if (level === 4) {\n   222\t        // RCL4: 需要建造 10 Extensions + 
Storage, builder 优先\n   223\t        return { harvester: 3, builder: sites > 0
? 3 : 1, upgrader: 3 };\n   224\t    } else {\n   225\t        // RCL5+: 
平衡配置\n   226\t        return { harvester: 3, builder: sites > 0 ? 2 : 1, 
upgrader: 3 };\n   227\t    }\n   228\t}\n   229\t\n   230\tfunction 
getBody(role, energy) {\n   231\t    if (energy >= 550) {\n   232\t        if 
(role === 'harvester' || role === 'upgrader') {\n   233\t            return 
[WORK, WORK, WORK, CARRY, CARRY, MOVE, MOVE, MOVE];\n   234\t        }\n   235\t
return [WORK, WORK, CARRY, CARRY, MOVE, MOVE, MOVE, MOVE];\n   236\t    } else 
if (energy >= 400) {\n   237\t        return [WORK, WORK, CARRY, CARRY, MOVE, 
MOVE];\n   238\t    } else if (energy >= 300) {\n   239\t        return [WORK, 
WORK, CARRY, MOVE];\n   240\t    }\n   241\t    return [WORK, CARRY, MOVE];\n   
242\t}\n   243\t\n   244\tfunction getBuildPositions(spawn) {\n   245\t    const
sx = spawn.pos.x, sy = spawn.pos.y;\n   246\t    return {\n   247\t        // 
RCL2: 5, RCL3: 10, RCL4: 20, RCL5: 30\n   248\t        // 
包含备用位置以防某些位置被占用\n   249\t        extensions: [\n   250\t         
// Ring 1 (positions 1-4)\n   251\t            {x: sx-1, y: sy-1}, {x: sx+1, y: 
sy-1}, {x: sx-1, y: sy+1}, {x: sx+1, y: sy+1},\n   252\t            // Ring 2 
(positions 5-10) - 注意 sy-2 可能被 Tower 占用\n   253\t            {x: sx+2, y:
sy}, {x: sx-2, y: sy}, {x: sx, y: sy-2}, {x: sx, y: sy+2},\n   254\t            
{x: sx+2, y: sy-1}, {x: sx-2, y: sy-1},\n   255\t            // Ring 3 
(positions 11-22) - for RCL4, 含备用位置\n   256\t            {x: sx+2, y: 
sy+1}, {x: sx-2, y: sy+1}, {x: sx+3, y: sy}, {x: sx-3, y: sy},\n   257\t        
{x: sx+3, y: sy-1}, {x: sx-3, y: sy-1}, {x: sx+3, y: sy+1}, {x: sx-3, y: 
sy+1},\n   258\t            {x: sx+2, y: sy-2}, {x: sx-2, y: sy-2},\n   259\t   
{x: sx+4, y: sy}, {x: sx-4, y: sy},  // 备用位置\n   260\t            // Ring 4 
(positions 23-34) - for RCL5, 含备用位置\n   261\t            {x: sx+2, y: 
sy+2}, {x: sx-2, y: sy+2}, {x: sx+1, y: sy-3}, {x: sx-1, y: sy-3},\n   262\t    
{x: sx+1, y: sy+3}, {x: sx-1, y: sy+3}, {x: sx+3, y: sy-2}, {x: sx-3, y: 
sy-2},\n   263\t            {x: sx+3, y: sy+2}, {x: sx-3, y: sy+2},\n   264\t   
{x: sx+4, y: sy-1}, {x: sx-4, y: sy-1}  // 备用位置\n   265\t        ],\n   
266\t        towers: [{x: sx, y: sy-2}, {x: sx-2, y: sy-2}],  // 2nd tower for 
RCL5\n   267\t        storage: [{x: sx-1, y: sy}]  // Storage for RCL4\n   268\t
};\n   269\t}\n   270\t\n   271\t// ========== 主循环 ==========\n   272\t\n   
273\tmodule.exports.loop = function () {\n   274\t    // 清理\n   275\t    for 
(const name in Memory.creeps) {\n   276\t        if (!Game.creeps[name]) delete 
Memory.creeps[name];\n   277\t    }\n   278\t    \n   279\t    // 获取 Spawn\n  
280\t    const spawns = Object.values(Game.spawns);\n   281\t    if 
(spawns.length === 0) {\n   282\t        emitEvent('NO_SPAWN');\n   283\t       
return;\n   284\t    }\n   285\t    const spawn = spawns[0];\n   286\t    const 
room = spawn.room;\n   287\t    const controller = room.controller;\n   288\t   
\n   289\t    // 检测事件\n   290\t    checkEvents(room, spawn);\n   291\t    \n
292\t    // Creep 管理\n   293\t    const targets = getCreepTargets(room);\n   
294\t    const counts = { harvester: 0, builder: 0, upgrader: 0 };\n   295\t    
for (const name in Game.creeps) {\n   296\t        const role = 
Game.creeps[name].memory.role;\n   297\t        if (counts[role] !== undefined) 
counts[role]++;\n   298\t    }\n   299\t    \n   300\t    // 建筑规划\n   301\t 
if (Game.time % 50 === 0) planBuildings(room, controller.level, spawn);\n   
302\t    \n   303\t    // 孵化\n   304\t    if (!spawn.spawning) {\n   305\t    
const energy = room.energyAvailable;\n   306\t        const capacity = 
room.energyCapacityAvailable;\n   307\t        const totalCreeps = 
Object.keys(Game.creeps).length;\n   308\t        const totalNeeded = 
targets.harvester + targets.builder + targets.upgrader;\n   309\t        \n   
310\t        // 检查是否有 creep 即将死亡（需要预防性孵化）\n   311\t        // 
TTL < 孵化时间(body*3) + 移动到Source时间(~50) + 缓冲(50) ≈ 150 ticks\n   312\t 
const creepsByRole = { harvester: [], builder: [], upgrader: [] };\n   313\t    
for (const name in Game.creeps) {\n   314\t            const creep = 
Game.creeps[name];\n   315\t            const role = creep.memory.role;\n   
316\t            if (creepsByRole[role]) {\n   317\t                
creepsByRole[role].push(creep);\n   318\t            }\n   319\t        }\n   
320\t        \n   321\t        // 找出需要紧急替换的角色\n   322\t        let 
urgentRole = null;\n   323\t        for (const role of ['harvester', 'builder', 
'upgrader']) {\n   324\t            const roleCreeps = creepsByRole[role];\n   
325\t            // 检查是否有 creep 即将死亡且会导致数量不足\n   326\t         
const dyingCount = roleCreeps.filter(c => c.ticksToLive && c.ticksToLive < 
150).length;\n   327\t            const effectiveCount = roleCreeps.length - 
dyingCount;\n   328\t            if (effectiveCount < targets[role]) {\n   329\t
urgentRole = role;\n   330\t                break;\n   331\t            }\n   
332\t        }\n   333\t        \n   334\t        // 紧急模式: harvester < 2 或 
creep 总数严重不足\n   335\t        // 正常模式: 等待至少 550 能量 (或满容量) 
孵化更强的 creep\n   336\t        // 恢复模式: creep 数量不足目标时，降低门槛到 
400\n   337\t        // 紧急替换模式: 某角色即将死亡，降低门槛到 300\n   338\t  
const isEmergency = counts.harvester < 2;\n   339\t        const isUrgentReplace
= urgentRole !== null;\n   340\t        const isRecovery = totalCreeps < 
totalNeeded;\n   341\t        const minSpawnEnergy = isEmergency ? 200 : 
(isUrgentReplace ? 300 : (isRecovery ? 400 : Math.min(550, capacity)));\n   
342\t        \n   343\t        // 优先孵化紧急替换的角色\n   344\t        const 
roleOrder = urgentRole ? [urgentRole, ...['harvester', 'builder', 
'upgrader'].filter(r => r !== urgentRole)] : ['harvester', 'builder', 
'upgrader'];\n   345\t        \n   346\t        for (const role of roleOrder) 
{\n   347\t            if (counts[role] < targets[role] || (urgentRole === role 
&& isUrgentReplace)) {\n   348\t                if (energy >= minSpawnEnergy) 
{\n   349\t                    // 使用当前可用能量 (最多到 capacity)\n   350\t  
const useEnergy = Math.min(capacity, energy);\n   351\t                    const
body = getBody(role, useEnergy);\n   352\t                    const name = role 
+ Game.time;\n   353\t                    if (spawn.spawnCreep(body, name, { 
memory: { role } }) === OK) {\n   354\t                        if 
(isUrgentReplace && role === urgentRole) {\n   355\t                            
emitEvent('SPAWN_REPLACE', `${name}:urgent`);\n   356\t                        }
else {\n   357\t                            emitEvent('SPAWN_COMPLETE', name);\n
358\t                        }\n   359\t                    }\n   360\t         
}\n   361\t                break;\n   362\t            }\n   363\t        }\n   
364\t    }\n   365\t    \n   366\t    // 运行 Creep\n   367\t    for (const name
in Game.creeps) {\n   368\t        const creep = Game.creeps[name];\n   369\t   
const role = creep.memory.role;\n   370\t        if (role === 'harvester') 
runHarvester(creep);\n   371\t        else if (role === 'upgrader') 
runUpgrader(creep);\n   372\t        else if (role === 'builder') 
runBuilder(creep);\n   373\t    }\n   374\t    \n   375\t    // Tower 防御\n   
376\t    runTowers(room);\n   377\t    \n   378\t    // 状态 (每 100 ticks)\n   
379\t    if (Game.time % 100 === 0) {\n   380\t        const cpu = 
Game.cpu.getUsed();\n   381\t        console.log(`[STATUS] T:${Game.time} 
CPU:${cpu.toFixed(1)} Creeps:${Object.keys(Game.creeps).length} 
RCL:${controller.level}`);\n   382\t    }\n   383\t};\n   384\t\n   385\t// 
========== 建筑规划 ==========\n   386\t\n   387\tfunction planBuildings(room, 
level, spawn) {\n   388\t    const plans = getBuildPositions(spawn);\n   389\t  
\n   390\t    const maxExt = 
CONTROLLER_STRUCTURES[STRUCTURE_EXTENSION][level];\n   391\t    const curExt = 
room.find(FIND_MY_STRUCTURES, { filter: s => s.structureType === 
STRUCTURE_EXTENSION }).length;\n   392\t    const siteExt = 
room.find(FIND_MY_CONSTRUCTION_SITES, { filter: s => s.structureType === 
STRUCTURE_EXTENSION }).length;\n   393\t    \n   394\t    let needed = maxExt - 
curExt - siteExt;\n   395\t    for (const pos of plans.extensions) {\n   396\t  
if (needed <= 0) break;\n   397\t        if (canBuildAt(room, pos.x, pos.y)) {\n
398\t            if (room.createConstructionSite(pos.x, pos.y, 
STRUCTURE_EXTENSION) === OK) needed--;\n   399\t        }\n   400\t    }\n   
401\t    \n   402\t    // Tower (RCL3+)\n   403\t    if (level >= 3) {\n   404\t
const maxTowers = CONTROLLER_STRUCTURES[STRUCTURE_TOWER][level];\n   405\t      
const curTowers = room.find(FIND_MY_STRUCTURES, { filter: s => s.structureType 
=== STRUCTURE_TOWER }).length;\n   406\t        const siteTowers = 
room.find(FIND_MY_CONSTRUCTION_SITES, { filter: s => s.structureType === 
STRUCTURE_TOWER }).length;\n   407\t        \n   408\t        if (curTowers + 
siteTowers < maxTowers) {\n   409\t            for (const pos of plans.towers) 
{\n   410\t                if (canBuildAt(room, pos.x, pos.y)) {\n   411\t      
room.createConstructionSite(pos.x, pos.y, STRUCTURE_TOWER);\n   412\t           
break;\n   413\t                }\n   414\t            }\n   415\t        }\n   
416\t    }\n   417\t    \n   418\t    // Storage (RCL4+)\n   419\t    if (level 
>= 4 && plans.storage) {\n   420\t        const curStorage = 
room.find(FIND_MY_STRUCTURES, { filter: s => s.structureType === 
STRUCTURE_STORAGE }).length;\n   421\t        const siteStorage = 
room.find(FIND_MY_CONSTRUCTION_SITES, { filter: s => s.structureType === 
STRUCTURE_STORAGE }).length;\n   422\t        \n   423\t        if (curStorage +
siteStorage === 0) {\n   424\t            for (const pos of plans.storage) {\n  
425\t                if (canBuildAt(room, pos.x, pos.y)) {\n   426\t            
room.createConstructionSite(pos.x, pos.y, STRUCTURE_STORAGE);\n   427\t         
break;\n   428\t                }\n   429\t            }\n   430\t        }\n   
431\t    }\n   432\t    \n   433\t    // Rampart 保护关键建筑 (RCL2+)\n   434\t 
if (level >= 2) {\n   435\t        // 保护 Spawn\n   436\t        const 
spawnRampart = room.lookForAt(LOOK_STRUCTURES, spawn.pos.x, spawn.pos.y)\n   
437\t            .some(s => s.structureType === STRUCTURE_RAMPART);\n   438\t   
const spawnRampartSite = room.lookForAt(LOOK_CONSTRUCTION_SITES, spawn.pos.x, 
spawn.pos.y)\n   439\t            .some(s => s.structureType === 
STRUCTURE_RAMPART);\n   440\t        if (!spawnRampart && !spawnRampartSite) {\n
441\t            room.createConstructionSite(spawn.pos.x, spawn.pos.y, 
STRUCTURE_RAMPART);\n   442\t        }\n   443\t        \n   444\t        // 
保护 Tower\n   445\t        const towers = room.find(FIND_MY_STRUCTURES, { 
filter: s => s.structureType === STRUCTURE_TOWER });\n   446\t        for (const
tower of towers) {\n   447\t            const hasRampart = 
room.lookForAt(LOOK_STRUCTURES, tower.pos.x, tower.pos.y)\n   448\t             
.some(s => s.structureType === STRUCTURE_RAMPART);\n   449\t            const 
hasSite = room.lookForAt(LOOK_CONSTRUCTION_SITES, tower.pos.x, tower.pos.y)\n   
450\t                .some(s => s.structureType === STRUCTURE_RAMPART);\n   
451\t            if (!hasRampart && !hasSite) {\n   452\t                
room.createConstructionSite(tower.pos.x, tower.pos.y, STRUCTURE_RAMPART);\n   
453\t            }\n   454\t        }\n   455\t    }\n   456\t}\n   457\t\n   
458\tfunction canBuildAt(room, x, y) {\n   459\t    if (x < 1 || x > 48 || y < 1
|| y > 48) return false;\n   460\t    return room.lookForAt(LOOK_STRUCTURES, x, 
y).length === 0 &&\n   461\t           room.lookForAt(LOOK_CONSTRUCTION_SITES, 
x, y).length === 0 &&\n   462\t           room.getTerrain().get(x, y) !== 
TERRAIN_MASK_WALL;\n   463\t}\n   464\t\n   465\t// ========== Tower 
==========\n   466\t\n   467\tfunction runTowers(room) {\n   468\t    const 
towers = room.find(FIND_MY_STRUCTURES, { filter: s => s.structureType === 
STRUCTURE_TOWER });\n   469\t    \n   470\t    for (const tower of towers) {\n  
471\t        // 优先攻击敌人\n   472\t        const enemy = 
tower.pos.findClosestByRange(FIND_HOSTILE_CREEPS);\n   473\t        if (enemy) {
tower.attack(enemy); continue; }\n   474\t        \n   475\t        // 
修复受损建筑 (不含 walls)\n   476\t        const damaged = 
tower.pos.findClosestByRange(FIND_STRUCTURES, {\n   477\t            filter: s 
=> s.hits < s.hitsMax * 0.5 && \n   478\t                        s.structureType
!== STRUCTURE_WALL\n   479\t        });\n   480\t        if (damaged && 
tower.store[RESOURCE_ENERGY] > 500) { tower.repair(damaged); continue; }\n   
481\t        \n   482\t        // 空闲时加固 Ramparts (目标 100K HP，与 builder 
保持一致)\n   483\t        const weakRampart = 
tower.pos.findClosestByRange(FIND_MY_STRUCTURES, {\n   484\t            filter: 
s => s.structureType === STRUCTURE_RAMPART && s.hits < 100000\n   485\t        
});\n   486\t        if (weakRampart && tower.store[RESOURCE_ENERGY] > 700) 
tower.repair(weakRampart);\n   487\t    }\n   488\t}\n   489\t\n   490\t// 
========== Creep 行为 ==========\n   491\t\n   492\tfunction runHarvester(creep)
{\n   493\t    if (creep.memory.working && creep.store[RESOURCE_ENERGY] === 0) 
{\n   494\t        creep.memory.working = false;\n   495\t        delete 
creep.memory.targetId;\n   496\t    }\n   497\t    if (!creep.memory.working && 
creep.store.getFreeCapacity() === 0) {\n   498\t        creep.memory.working = 
true;\n   499\t        delete creep.memory.targetId;\n   500\t    }\n   501\t   
\n   502\t    if (creep.memory.working) {\n   503\t        let target = 
Game.getObjectById(creep.memory.targetId);\n   504\t        if (!target || 
(target.store && target.store.getFreeCapacity(RESOURCE_ENERGY) === 0)) {\n   
505\t            target = creep.pos.findClosestByPath(FIND_MY_STRUCTURES, {\n   
506\t                filter: s => (s.structureType === STRUCTURE_SPAWN ||\n   
507\t                             s.structureType === STRUCTURE_EXTENSION ||\n  
508\t                             s.structureType === STRUCTURE_TOWER) &&\n   
509\t                             s.store.getFreeCapacity(RESOURCE_ENERGY) > 0\n
510\t            });\n   511\t            creep.memory.targetId = target ? 
target.id : null;\n   512\t        }\n   513\t        if (target) {\n   514\t   
if (creep.transfer(target, RESOURCE_ENERGY) === ERR_NOT_IN_RANGE) 
creep.moveTo(target, {reusePath: 5});\n   515\t        } else {\n   516\t       
if (creep.upgradeController(creep.room.controller) === ERR_NOT_IN_RANGE) 
creep.moveTo(creep.room.controller, {reusePath: 5});\n   517\t        }\n   
518\t    } else {\n   519\t        let source = 
Game.getObjectById(creep.memory.sourceId);\n   520\t        if (!source || 
source.energy === 0) {\n   521\t            source = 
creep.pos.findClosestByPath(FIND_SOURCES_ACTIVE);\n   522\t            
creep.memory.sourceId = source ? source.id : null;\n   523\t        }\n   524\t 
if (source && creep.harvest(source) === ERR_NOT_IN_RANGE) creep.moveTo(source, 
{reusePath: 5});\n   525\t    }\n   526\t}\n   527\t\n   528\tfunction 
runUpgrader(creep) {\n   529\t    if (creep.memory.working && 
creep.store[RESOURCE_ENERGY] === 0) creep.memory.working = false;\n   530\t    
if (!creep.memory.working && creep.store.getFreeCapacity() === 0) 
creep.memory.working = true;\n   531\t    \n   532\t    if 
(creep.memory.working) {\n   533\t        if 
(creep.upgradeController(creep.room.controller) === ERR_NOT_IN_RANGE) 
creep.moveTo(creep.room.controller, {reusePath: 5});\n   534\t    } else {\n   
535\t        let source = Game.getObjectById(creep.memory.sourceId);\n   536\t  
if (!source || source.energy === 0) {\n   537\t            source = 
creep.pos.findClosestByPath(FIND_SOURCES_ACTIVE);\n   538\t            
creep.memory.sourceId = source ? source.id : null;\n   539\t        }\n   540\t 
if (source && creep.harvest(source) === ERR_NOT_IN_RANGE) creep.moveTo(source, 
{reusePath: 5});\n   541\t    }\n   542\t}\n   543\t\n   544\tfunction 
runBuilder(creep) {\n   545\t    if (creep.memory.working && 
creep.store[RESOURCE_ENERGY] === 0) {\n   546\t        creep.memory.working = 
false;\n   547\t        delete creep.memory.targetId;\n   548\t    }\n   549\t  
if (!creep.memory.working && creep.store.getFreeCapacity() === 0) {\n   550\t   
creep.memory.working = true;\n   551\t        delete creep.memory.targetId;\n   
552\t    }\n   553\t    \n   554\t    if (creep.memory.working) {\n   555\t     
let target = Game.getObjectById(creep.memory.targetId);\n   556\t        \n   
557\t        // 验证目标是否仍然有效\n   558\t        if (target) {\n   559\t   
// 如果是 Rampart 且已达到目标 HP，清除缓存\n   560\t            if 
(target.structureType === STRUCTURE_RAMPART && target.hits >= 100000) {\n   
561\t                target = null;\n   562\t                delete 
creep.memory.targetId;\n   563\t            }\n   564\t        }\n   565\t      
\n   566\t        if (!target) {\n   567\t            // 优先级: 工地 > 弱 
Ramparts > 升级控制器\n   568\t            const sites = 
creep.room.find(FIND_MY_CONSTRUCTION_SITES);\n   569\t            target = 
sites.find(s => s.structureType === STRUCTURE_TOWER) ||\n   570\t               
sites.find(s => s.structureType === STRUCTURE_EXTENSION) ||\n   571\t           
sites[0];\n   572\t            \n   573\t            // 如果没有工地，修复 
Ramparts (目标 100K HP)\n   574\t            if (!target) {\n   575\t           
// 找最弱的 Rampart 优先修复\n   576\t                const weakRamparts = 
creep.room.find(FIND_MY_STRUCTURES, {\n   577\t                    filter: s => 
s.structureType === STRUCTURE_RAMPART && s.hits < 100000\n   578\t              
});\n   579\t                if (weakRamparts.length > 0) {\n   580\t           
weakRamparts.sort((a, b) => a.hits - b.hits);\n   581\t                    
target = weakRamparts[0];\n   582\t                }\n   583\t            }\n   
584\t            creep.memory.targetId = target ? target.id : null;\n   585\t   
}\n   586\t        \n   587\t        if (target) {\n   588\t            // 
判断是建造还是修复\n   589\t            if (target.progressTotal !== undefined) 
{\n   590\t                // Construction site\n   591\t                if 
(creep.build(target) === ERR_NOT_IN_RANGE) creep.moveTo(target, {reusePath: 
5});\n   592\t            } else {\n   593\t                // Repair rampart\n 
594\t                if (creep.repair(target) === ERR_NOT_IN_RANGE) 
creep.moveTo(target, {reusePath: 5});\n   595\t            }\n   596\t        } 
else {\n   597\t            // 没有任务时升级控制器\n   598\t            if 
(creep.upgradeController(creep.room.controller) === ERR_NOT_IN_RANGE) 
creep.moveTo(creep.room.controller, {reusePath: 5});\n   599\t        }\n   
600\t    } else {\n   601\t        let source = 
Game.getObjectById(creep.memory.sourceId);\n   602\t        if (!source || 
source.energy === 0) {\n   603\t            source = 
creep.pos.findClosestByPath(FIND_SOURCES_ACTIVE);\n   604\t            
creep.memory.sourceId = source ? source.id : null;\n   605\t        }\n   606\t 
if (source && creep.harvest(source) === ERR_NOT_IN_RANGE) creep.moveTo(source, 
{reusePath: 5});\n   607\t    }\n   608\t}\n",
        message='608 lines read from file starting from line 1. End of file 
reached.',
        display=[],
        extras=None
    )
)
ToolResult(
    tool_call_id='toolu_012MtZ3hjJXK2q3mtGucRzdG',
    return_value=ToolReturnValue(
        is_error=False,
        output='{"ok":1,"result":{"ok":1,"n":1},"ops":[{"user":"695ceeec11c0dd00
12abe528","expression":"JSON.stringify({tick:Game.time,rcl:Game.rooms.E13S35.con
troller.level,progress:Game.rooms.E13S35.controller.progress,progressTotal:Game.
rooms.E13S35.controller.progressTotal,creeps:Object.keys(Game.creeps).length,spa
wns:Object.keys(Game.spawns).length,sites:Object.keys(Game.constructionSites).le
ngth,energy:Game.rooms.E13S35.energyAvailable,energyCap:Game.rooms.E13S35.energy
CapacityAvailable})","shard":"shard3","_id":"695f668ca04dcb0012a63bdf"}],"insert
edCount":1,"insertedIds":["695f668ca04dcb0012a63bdf"]}',
        message='Command executed successfully.',
        display=[],
        extras=None
    )
)
StepBegin(n=3)
TextPart(type='text', text='让我等待一下获取控制台返回的游戏状态：')
ToolCall(
    type='function',
    id='toolu_01UHBpbHLUeXP8bB5CCAkH8t',
    function=FunctionBody(
        name='Shell',
        arguments='{"command": "sleep 5 && curl -s 
\\"https://screeps.com/api/user/console\\" -H \\"X-Token: 
9532a4c3-b950-4798-bb97-e7d441ef41e2\\" -H \\"Content-Type: application/json\\" 
-d 
\'{\\"expression\\":\\"JSON.stringify({tick:Game.time,rcl:Game.rooms.E13S35.cont
roller.level,progress:Game.rooms.E13S35.controller.progress,progressTotal:Game.r
ooms.E13S35.controller.progressTotal,creeps:Object.keys(Game.creeps).length,spaw
ns:Object.keys(Game.spawns).length,sites:Object.keys(Game.constructionSites).len
gth,energy:Game.rooms.E13S35.energyAvailable,energyCap:Game.rooms.E13S35.energyC
apacityAvailable,ext:Game.rooms.E13S35.find(FIND_MY_STRUCTURES).filter(s=>s.stru
ctureType==STRUCTURE_EXTENSION).length,towers:Game.rooms.E13S35.find(FIND_MY_STR
UCTURES).filter(s=>s.structureType==STRUCTURE_TOWER).length,storage:Game.rooms.E
13S35.find(FIND_MY_STRUCTURES).filter(s=>s.structureType==STRUCTURE_STORAGE).len
gth,ramparts:Game.rooms.E13S35.find(FIND_MY_STRUCTURES).filter(s=>s.structureTyp
e==STRUCTURE_RAMPART).length})\\",\\"shard\\":\\"shard3\\"}\'", "timeout": 30}'
    ),
    extras=None
)
ToolCall(
    type='function',
    id='toolu_01CtMVF8sz42NdPr2JPMi3j7',
    function=FunctionBody(
        name='Glob',
        arguments='{"pattern": "knowledge/*.md"}'
    ),
    extras=None
)
StatusUpdate(
    context_usage=0.110945,
    token_usage=TokenUsage(
        input_other=1,
        output=502,
        input_cache_read=9028,
        input_cache_creation=13160
    ),
    message_id='msg_01EMoxvszyL2LFk1n9EMyL9f'
)
ToolResult(
    tool_call_id='toolu_01CtMVF8sz42NdPr2JPMi3j7',
    return_value=ToolOk(
        is_error=False,
        output='knowledge/README.md\nknowledge/code_design.md\nknowledge/game_ba
sics.md\nknowledge/intel.md\nknowledge/lessons_learned.md',
        message='Found 5 matches for pattern `knowledge/*.md`.',
        display=[],
        extras=None
    )
)
ToolResult(
    tool_call_id='toolu_01UHBpbHLUeXP8bB5CCAkH8t',
    return_value=ToolReturnValue(
        is_error=False,
        output='{"ok":1,"result":{"ok":1,"n":1},"ops":[{"user":"695ceeec11c0dd00
12abe528","expression":"JSON.stringify({tick:Game.time,rcl:Game.rooms.E13S35.con
troller.level,progress:Game.rooms.E13S35.controller.progress,progressTotal:Game.
rooms.E13S35.controller.progressTotal,creeps:Object.keys(Game.creeps).length,spa
wns:Object.keys(Game.spawns).length,sites:Object.keys(Game.constructionSites).le
ngth,energy:Game.rooms.E13S35.energyAvailable,energyCap:Game.rooms.E13S35.energy
CapacityAvailable,ext:Game.rooms.E13S35.find(FIND_MY_STRUCTURES).filter(s=>s.str
uctureType==STRUCTURE_EXTENSION).length,towers:Game.rooms.E13S35.find(FIND_MY_ST
RUCTURES).filter(s=>s.structureType==STRUCTURE_TOWER).length,storage:Game.rooms.
E13S35.find(FIND_MY_STRUCTURES).filter(s=>s.structureType==STRUCTURE_STORAGE).le
ngth,ramparts:Game.rooms.E13S35.find(FIND_MY_STRUCTURES).filter(s=>s.structureTy
pe==STRUCTURE_RAMPART).length})","shard":"shard3","_id":"695f669e11c0dd0012acc2a
d"}],"insertedCount":1,"insertedIds":["695f669e11c0dd0012acc2ad"]}',
        message='Command executed successfully.',
        display=[],
        extras=None
    )
)
StepBegin(n=4)
TextPart(type='text', text='让我通过 Memory API 获取最新的控制台输出：')
ToolCall(
    type='function',
    id='toolu_01Bunumx75d1gQcKjtoSBgRo',
    function=FunctionBody(
        name='Shell',
        arguments='{"command": "sleep 3 && curl -s 
\\"https://screeps.com/api/user/memory-segment?segment=0&shard=shard3\\" -H 
\\"X-Token: 9532a4c3-b950-4798-bb97-e7d441ef41e2\\" 2>/dev/null | head -c 2000",
"timeout": 30}'
    ),
    extras=None
)
ToolCall(
    type='function',
    id='toolu_014mSZz7LMuRr9gvQihCzNyd',
    function=FunctionBody(name='Shell', arguments=''),
    extras=None
)
ToolResult(
    tool_call_id='toolu_01Bunumx75d1gQcKjtoSBgRo',
    return_value=ToolReturnValue(
        is_error=False,
        output='{"ok":1,"data":null}',
        message='Command executed successfully.',
        display=[],
        extras=None
    )
)
ToolCallPart(
    arguments_part='{"command": "# 使用 room-objects API 获取房间数据\\ncurl -s 
\\"https://screeps.com/api/game/room-objects?room=E13S35&shard=shard3\\" -H 
\\"X-Token: 9532a4c3-b950-4798-bb97-e7d441ef41e2\\" 2>/dev/null | python3 -c 
\\"\\nimport json,sys\\ndata = json.load(sys.stdin)\\nif data.get(\'ok\'):\\n   
objs = data.get(\'objects\', {})\\n    # Count by type\\n    counts = {}\\n    
my_creeps = []\\n    sites = []\\n    controller = None\\n    for obj in 
objs.values():\\n        t = obj.get(\'type\')\\n        if t:\\n            
counts[t] = counts.get(t, 0) + 1\\n        if t == \'creep\' and 
obj.get(\'user\') == \'695ceeec11c0dd0012abe528\':\\n            
my_creeps.append({\'name\': obj.get(\'name\'), \'hits\': obj.get(\'hits\'), 
\'hitsMax\': obj.get(\'hitsMax\')})\\n        if t == \'constructionSite\' and 
obj.get(\'user\') == \'695ceeec11c0dd0012abe528\':\\n            
sites.append({\'type\': obj.get(\'structureType\'), \'progress\': 
obj.get(\'progress\'), \'progressTotal\': obj.get(\'progressTotal\')})\\n       
if t == \'controller\':\\n            controller = {\'level\': 
obj.get(\'level\'), \'progress\': obj.get(\'progress\'), \'progressTotal\': 
obj.get(\'progressTotal\'), \'safeMode\': obj.get(\'safeMode\'), 
\'safeModeAvailable\': obj.get(\'safeModeAvailable\')}\\n    
print(\'Controller:\', controller)\\n    print(\'Object counts:\', {k:v for k,v 
in counts.items() if v > 0})\\n    print(\'My creeps:\', len(my_creeps), 
my_creeps[:5])\\n    print(\'Construction sites:\', len(sites), 
sites[:10])\\n\\"\\n", "timeout": 30}'
)
StatusUpdate(
    context_usage=0.11605,
    token_usage=TokenUsage(
        input_other=1,
        output=724,
        input_cache_read=22188,
        input_cache_creation=1021
    ),
    message_id='msg_017QxVsRCtn1zospaweDESMU'
)
ToolResult(
    tool_call_id='toolu_014mSZz7LMuRr9gvQihCzNyd',
    return_value=ToolReturnValue(
        is_error=True,
        output='Traceback (most recent call last):\n  File "<string>", line 11, 
in <module>\nAttributeError: \'list\' object has no attribute \'values\'\n',
        message='Command failed with exit code: 1.',
        display=[
            BriefDisplayBlock(type='brief', text='Failed with exit code: 1')
        ],
        extras=None
    )
)
StepBegin(n=5)
ToolCall(
    type='function',
    id='toolu_01NPVB9qvU3BkNst9WQnjZEJ',
    function=FunctionBody(
        name='Shell',
        arguments='{"command": "# 使用 room-objects API 获取房间数据\\ncurl -s 
\\"https://screeps.com/api/game/room-objects?room=E13S35&shard=shard3\\" -H 
\\"X-Token: 9532a4c3-b950-4798-bb97-e7d441ef41e2\\" 2>/dev/null | python3 -c 
\\"\\nimport json,sys\\ndata = json.load(sys.stdin)\\nif data.get(\'ok\'):\\n   
objs = data.get(\'objects\', [])\\n    # Count by type\\n    counts = {}\\n    
my_creeps = []\\n    sites = []\\n    controller = None\\n    extensions = []\\n
towers = []\\n    storage = []\\n    ramparts = []\\n    spawn = None\\n    for 
obj in objs:\\n        t = obj.get(\'type\')\\n        if t:\\n            
counts[t] = counts.get(t, 0) + 1\\n        if t == \'creep\' and 
obj.get(\'user\') == \'695ceeec11c0dd0012abe528\':\\n            
my_creeps.append({\'name\': obj.get(\'name\'), \'role\': 
obj.get(\'name\',\'\')[:4], \'ticksToLive\': obj.get(\'ticksToLive\')})\\n      
if t == \'constructionSite\' and obj.get(\'user\') == 
\'695ceeec11c0dd0012abe528\':\\n            sites.append({\'type\': 
obj.get(\'structureType\'), \'progress\': obj.get(\'progress\'), 
\'progressTotal\': obj.get(\'progressTotal\')})\\n        if t == 
\'controller\':\\n            controller = {\'level\': obj.get(\'level\'), 
\'progress\': obj.get(\'progress\'), \'progressTotal\': 
obj.get(\'progressTotal\'), \'safeMode\': obj.get(\'safeMode\'), 
\'safeModeAvailable\': obj.get(\'safeModeAvailable\')}\\n        if t == 
\'extension\' and obj.get(\'user\') == \'695ceeec11c0dd0012abe528\':\\n         
extensions.append({\'energy\': obj.get(\'store\',{}).get(\'energy\',0)})\\n     
if t == \'tower\' and obj.get(\'user\') == \'695ceeec11c0dd0012abe528\':\\n     
towers.append({\'energy\': obj.get(\'store\',{}).get(\'energy\',0), \'hits\': 
obj.get(\'hits\')})\\n        if t == \'storage\' and obj.get(\'user\') == 
\'695ceeec11c0dd0012abe528\':\\n            storage.append({\'energy\': 
obj.get(\'store\',{}).get(\'energy\',0)})\\n        if t == \'rampart\' and 
obj.get(\'user\') == \'695ceeec11c0dd0012abe528\':\\n            
ramparts.append({\'hits\': obj.get(\'hits\')})\\n        if t == \'spawn\' and 
obj.get(\'user\') == \'695ceeec11c0dd0012abe528\':\\n            spawn = 
{\'name\': obj.get(\'name\'), \'energy\': 
obj.get(\'store\',{}).get(\'energy\',0), \'hits\': obj.get(\'hits\')}\\n    
print(\'=== GAME STATUS ===\')\\n    print(f\'Controller: RCL 
{controller[\\\\\\"level\\\\\\"]}, Progress: 
{controller[\\\\\\"progress\\\\\\"]}/{controller[\\\\\\"progressTotal\\\\\\"]} 
({100*controller[\\\\\\"progress\\\\\\"]/controller[\\\\\\"progressTotal\\\\\\"]
:.1f}%)\')\\n    print(f\'SafeMode: {controller[\\\\\\"safeMode\\\\\\"]}, 
Available: {controller[\\\\\\"safeModeAvailable\\\\\\"]}\')\\n    
print(f\'Spawn: {spawn}\')\\n    print(f\'Extensions: {len(extensions)} (energy 
cap: {300 + len(extensions)*50})\')\\n    print(f\'Towers: {len(towers)} - 
{towers}\')\\n    print(f\'Storage: {len(storage)} - {storage}\')\\n    
print(f\'Ramparts: {len(ramparts)} - HP: {[r[\\\\\\"hits\\\\\\"] for r in 
ramparts]}\')\\n    print(f\'My Creeps: {len(my_creeps)}\')\\n    for c in 
my_creeps:\\n        print(f\'  - {c[\\\\\\"name\\\\\\"]} 
TTL:{c[\\\\\\"ticksToLive\\\\\\"]}\')\\n    print(f\'Construction Sites: 
{len(sites)}\')\\n    for s in sites[:15]:\\n        print(f\'  - 
{s[\\\\\\"type\\\\\\"]}: 
{s[\\\\\\"progress\\\\\\"]}/{s[\\\\\\"progressTotal\\\\\\"]} 
({100*s[\\\\\\"progress\\\\\\"]/s[\\\\\\"progressTotal\\\\\\"]:.1f}%)\')\\n\\"\\
n", "timeout": 30}'
    ),
    extras=None
)
StatusUpdate(
    context_usage=0.12038,
    token_usage=TokenUsage(
        input_other=1,
        output=1184,
        input_cache_read=23209,
        input_cache_creation=866
    ),
    message_id='msg_01HT8Kb6PmFN17fasD8zWm7J'
)
ToolResult(
    tool_call_id='toolu_01NPVB9qvU3BkNst9WQnjZEJ',
    return_value=ToolReturnValue(
        is_error=True,
        output='Traceback (most recent call last):\n  File "<string>", line 37, 
in <module>\nZeroDivisionError: division by zero\n=== GAME STATUS ===\n',
        message='Command failed with exit code: 1.',
        display=[
            BriefDisplayBlock(type='brief', text='Failed with exit code: 1')
        ],
        extras=None
    )
)
StepBegin(n=6)
ToolCall(
    type='function',
    id='toolu_01AhF9vCfAXFi77mQzAPVtWY',
    function=FunctionBody(
        name='Shell',
        arguments='{"command": "# 使用 room-objects API 获取房间数据\\ncurl -s 
\\"https://screeps.com/api/game/room-objects?room=E13S35&shard=shard3\\" -H 
\\"X-Token: 9532a4c3-b950-4798-bb97-e7d441ef41e2\\" 2>/dev/null | python3 -c 
\\"\\nimport json,sys\\ndata = json.load(sys.stdin)\\nif data.get(\'ok\'):\\n   
objs = data.get(\'objects\', [])\\n    # Count by type\\n    counts = {}\\n    
my_creeps = []\\n    sites = []\\n    controller = None\\n    extensions = []\\n
towers = []\\n    storage = []\\n    ramparts = []\\n    spawn = None\\n    for 
obj in objs:\\n        t = obj.get(\'type\')\\n        if t:\\n            
counts[t] = counts.get(t, 0) + 1\\n        if t == \'creep\' and 
obj.get(\'user\') == \'695ceeec11c0dd0012abe528\':\\n            
my_creeps.append({\'name\': obj.get(\'name\'), \'role\': 
obj.get(\'name\',\'\')[:4], \'ticksToLive\': obj.get(\'ticksToLive\')})\\n      
if t == \'constructionSite\' and obj.get(\'user\') == 
\'695ceeec11c0dd0012abe528\':\\n            pt = obj.get(\'progressTotal\', 1) 
or 1\\n            sites.append({\'type\': obj.get(\'structureType\'), 
\'progress\': obj.get(\'progress\',0), \'progressTotal\': pt})\\n        if t ==
\'controller\':\\n            controller = {\'level\': obj.get(\'level\'), 
\'progress\': obj.get(\'progress\',0), \'progressTotal\': 
obj.get(\'progressTotal\',1) or 1, \'safeMode\': obj.get(\'safeMode\'), 
\'safeModeAvailable\': obj.get(\'safeModeAvailable\')}\\n        if t == 
\'extension\' and obj.get(\'user\') == \'695ceeec11c0dd0012abe528\':\\n         
extensions.append({\'energy\': obj.get(\'store\',{}).get(\'energy\',0)})\\n     
if t == \'tower\' and obj.get(\'user\') == \'695ceeec11c0dd0012abe528\':\\n     
towers.append({\'energy\': obj.get(\'store\',{}).get(\'energy\',0), \'hits\': 
obj.get(\'hits\')})\\n        if t == \'storage\' and obj.get(\'user\') == 
\'695ceeec11c0dd0012abe528\':\\n            storage.append({\'energy\': 
obj.get(\'store\',{}).get(\'energy\',0)})\\n        if t == \'rampart\' and 
obj.get(\'user\') == \'695ceeec11c0dd0012abe528\':\\n            
ramparts.append({\'hits\': obj.get(\'hits\')})\\n        if t == \'spawn\' and 
obj.get(\'user\') == \'695ceeec11c0dd0012abe528\':\\n            spawn = 
{\'name\': obj.get(\'name\'), \'energy\': 
obj.get(\'store\',{}).get(\'energy\',0), \'hits\': obj.get(\'hits\')}\\n    
print(\'=== GAME STATUS ===\')\\n    print(f\'Controller: RCL 
{controller[\\\\\\"level\\\\\\"]}, Progress: 
{controller[\\\\\\"progress\\\\\\"]}/{controller[\\\\\\"progressTotal\\\\\\"]} 
({100*controller[\\\\\\"progress\\\\\\"]/controller[\\\\\\"progressTotal\\\\\\"]
:.1f}%)\')\\n    print(f\'SafeMode: {controller[\\\\\\"safeMode\\\\\\"]}, 
Available: {controller[\\\\\\"safeModeAvailable\\\\\\"]}\')\\n    
print(f\'Spawn: {spawn}\')\\n    print(f\'Extensions: {len(extensions)} (energy 
cap: {300 + len(extensions)*50})\')\\n    print(f\'Towers: {len(towers)} - 
{towers}\')\\n    print(f\'Storage: {len(storage)} - {storage}\')\\n    
print(f\'Ramparts: {len(ramparts)} - HP: {[r[\\\\\\"hits\\\\\\"] for r in 
ramparts]}\')\\n    print(f\'My Creeps: {len(my_creeps)}\')\\n    for c in 
my_creeps:\\n        print(f\'  - {c[\\\\\\"name\\\\\\"]} 
TTL:{c[\\\\\\"ticksToLive\\\\\\"]}\')\\n    print(f\'Construction Sites: 
{len(sites)}\')\\n    for s in sites[:15]:\\n        print(f\'  - 
{s[\\\\\\"type\\\\\\"]}: 
{s[\\\\\\"progress\\\\\\"]}/{s[\\\\\\"progressTotal\\\\\\"]} 
({100*s[\\\\\\"progress\\\\\\"]/s[\\\\\\"progressTotal\\\\\\"]:.1f}%)\')\\n\\"\\
n", "timeout": 30}'
    ),
    extras=None
)
StatusUpdate(
    context_usage=0.126645,
    token_usage=TokenUsage(
        input_other=1,
        output=1205,
        input_cache_read=24075,
        input_cache_creation=1253
    ),
    message_id='msg_01WUejveCjAjf2Rd5EhVfyBB'
)
ToolResult(
    tool_call_id='toolu_01AhF9vCfAXFi77mQzAPVtWY',
    return_value=ToolReturnValue(
        is_error=False,
        output="=== GAME STATUS ===\nController: RCL 4, Progress: 3058/1 
(305800.0%)\nSafeMode: 76628783, Available: 3\nSpawn: {'name': 'Spawn1', 
'energy': 36, 'hits': 5000}\nExtensions: 11 (energy cap: 850)\nTowers: 1 - 
[{'energy': 500, 'hits': 3000}]\nStorage: 0 - []\nRamparts: 2 - HP: [914701, 
494801]\nMy Creeps: 10\n  - harvester76657797 TTL:None\n  - builder76657954 
TTL:None\n  - harvester76658153 TTL:None\n  - harvester76658280 TTL:None\n  - 
builder76658408 TTL:None\n  - upgrader76658530 TTL:None\n  - upgrader76658632 
TTL:None\n  - upgrader76658732 TTL:None\n  - builder76658853 TTL:None\n  - 
harvester76659165 TTL:None\nConstruction Sites: 10\n  - extension: 1450/3000 
(48.3%)\n  - extension: 0/3000 (0.0%)\n  - extension: 0/3000 (0.0%)\n  - 
extension: 0/3000 (0.0%)\n  - extension: 0/3000 (0.0%)\n  - extension: 0/3000 
(0.0%)\n  - extension: 0/3000 (0.0%)\n  - extension: 0/3000 (0.0%)\n  - 
extension: 0/3000 (0.0%)\n  - storage: 0/30000 (0.0%)\n",
        message='Command executed successfully.',
        display=[],
        extras=None
    )
)
StepBegin(n=7)
TextPart(type='text', text='游戏状态看起来不错！让我检查知识库中的最新状态：')
ToolCall(
    type='function',
    id='toolu_01VrBbdntX4CzPR8NvCiNEdA',
    function=FunctionBody(
        name='ReadFile',
        arguments='{"path": "knowledge/lessons_learned.md"}'
    ),
    extras=None
)
ToolCall(
    type='function',
    id='toolu_0151NUob57QTbiKi6BgVsScc',
    function=FunctionBody(name='ReadFile', arguments=''),
    extras=None
)
ToolResult(
    tool_call_id='toolu_01VrBbdntX4CzPR8NvCiNEdA',
    return_value=ToolOk(
        is_error=False,
        output='     1\t# 教训与经验 (Lessons Learned)\n     2\t\n     3\t> 
记录失败和成功的经验，避免重复犯错\n     4\t\n     5\t---\n     6\t\n     7\t## 
🔴 重大失败事件\n     8\t\n     9\t### 2026-01-06: 殖民地丢失 (W48N24 -> 
W13N45)\n    10\t\n    11\t**事件**: 
殖民地在无人监控期间丢失，原房间被其他玩家占领\n    12\t\n    
13\t**原因分析**:\n    14\t1. 代码缺乏容错机制\n    15\t2. 没有监控和告警\n    
16\t3. Session 间隔太长 (2+ 小时)\n    17\t\n    18\t**教训**:\n    19\t- 
代码必须有健壮的错误处理\n    20\t- 需要记录关键事件到 Memory\n    21\t- 
需要定期检查游戏状态\n    22\t- 不能完全依赖 `Game.spawns[\'Spawn1\']`\n    
23\t\n    24\t**改进措施**:\n    25\t```javascript\n    26\t// 改进前\n    
27\tconst spawn = Game.spawns[\'Spawn1\'];\n    28\tif (!spawn) return;  // 
直接退出，没有任何处理\n    29\t\n    30\t// 改进后\n    31\tconst spawns = 
Object.values(Game.spawns);\n    32\tif (spawns.length === 0) {\n    33\t    // 
记录日志，可能触发告警\n    34\t    Memory.lastError = { time: Game.time, msg: 
\'No spawns available\' };\n    35\t    return;\n    36\t}\n    37\tconst spawn 
= spawns[0];\n    38\t```\n    39\t\n    40\t---\n    41\t\n    42\t### 
2026-01-07: API 调用硬编码房间名称\n    43\t\n    44\t**事件**: Agent 
检查游戏状态时，使用硬编码的房间名称 `W13N45` 调用 API，实际房间已变为 
`E13S35`，导致误判"殖民地丢失"\n    45\t\n    46\t**原因分析**:\n    47\t1. 
知识库中记录了旧房间名 `W13N45`\n    48\t2. API 调用直接使用硬编码的房间名\n    
49\t3. 没有先查询实际拥有的房间\n    50\t\n    51\t**正确的 API 调用顺序**:\n   
52\t```bash\n    53\t# 1. 先获取实际拥有的房间\n    54\tcurl 
"https://screeps.com/api/user/overview?statName=energyHarvested&interval=8"\n   
55\t# 返回: shards.shard3.rooms = [\'E13S35\']\n    56\t\n    57\t# 2. 
再用正确的房间名查询对象\n    58\tcurl 
"https://screeps.com/api/game/room-objects?room=E13S35&shard=shard3"\n    
59\t```\n    60\t\n    61\t**教训**:\n    62\t- ❌ 
不要硬编码房间名称到知识库或代码中\n    63\t- ✅ 每次都要先通过 API 
获取当前拥有的房间\n    64\t- ✅ 房间可能因重生、占领、丢失而改变\n    65\t\n   
66\t---\n    67\t\n    68\t### 2026-01-07: 代码硬编码建筑位置\n    69\t\n    
70\t**事件**: Extension 建造位置硬编码为相对于 (25,23) 的坐标，但新房间 Spawn 
位置是 (33,17)，导致 Extension 不会建造\n    71\t\n    72\t**原因分析**:\n    
73\t```javascript\n    74\t// 问题代码 - 硬编码位置\n    75\tconst 
EXTENSION_POSITIONS = [\n    76\t    {x: 24, y: 22},  // 相对于旧 Spawn 
(25,23)\n    77\t    {x: 26, y: 22},\n    78\t    // ...\n    79\t];\n    
80\t```\n    81\t\n    82\t**正确做法**:\n    83\t```javascript\n    84\t// 
动态计算位置\n    85\tfunction getExtensionPositions(spawn) {\n    86\t    const
x = spawn.pos.x;\n    87\t    const y = spawn.pos.y;\n    88\t    return [\n    
89\t        {x: x-1, y: y-1},  // 左上\n    90\t        {x: x+1, y: y-1},  // 
右上\n    91\t        {x: x-1, y: y+1},  // 左下\n    92\t        {x: x+1, y: 
y+1},  // 右下\n    93\t        {x: x+2, y: y},    // 右边\n    94\t    ];\n    
95\t}\n    96\t```\n    97\t\n    98\t**教训**:\n    99\t- ❌ 
不要硬编码任何与房间相关的坐标\n   100\t- ✅ 所有位置都应该相对于 Spawn 
动态计算\n   101\t- ✅ 代码必须能在任何房间运行\n   102\t\n   103\t---\n   
104\t\n   105\t## ✅ 成功经验\n   106\t\n   107\t### 快速发展策略\n   108\t- 
保护期内优先发展，不用担心防御\n   109\t- Harvester 优先级最高\n   110\t- Level 
2 后立即规划 Extension\n   111\t\n   112\t### CPU 优化\n   113\t- 缓存目标 ID 到
Memory\n   114\t- 使用 `reusePath: 5` 减少寻路\n   115\t- 非紧急操作每 N tick 
执行一次\n   116\t\n   117\t---\n   118\t\n   119\t## 📋 检查清单\n   120\t\n   
121\t每次 Session 开始时检查：\n   122\t- [ ] 控制器等级和 downgrade 时间\n   
123\t- [ ] Creep 数量是否正常\n   124\t- [ ] Spawn 是否在工作\n   125\t- [ ] 
能量流是否正常\n   126\t- [ ] 有无敌人\n   127\t\n   128\t每次代码修改时确认：\n
129\t- [ ] 本地测试通过\n   130\t- [ ] 没有硬编码依赖\n   131\t- [ ] 
有适当的错误处理\n   132\t- [ ] 记录关键日志\n   133\t\n   134\t---\n',
        message='134 lines read from file starting from line 1. End of file 
reached.',
        display=[],
        extras=None
    )
)
ToolCallPart(arguments_part='{"path": "knowledge/intel.md"}')
StatusUpdate(
    context_usage=0.13496,
    token_usage=TokenUsage(
        input_other=1,
        output=123,
        input_cache_read=25328,
        input_cache_creation=1663
    ),
    message_id='msg_01KBhUDxiDp2kWofBm5FXctM'
)
ToolResult(
    tool_call_id='toolu_0151NUob57QTbiKi6BgVsScc',
    return_value=ToolOk(
        is_error=False,
        output='     1\t# 侦查情报 (Intelligence)\n     2\t\n     3\t> 
记录周围玩家和房间的情报，帮助战略决策\n     4\t\n     5\t**当前房间**: E13S35 
(shard3)  \n     6\t**最后更新**: 2026-01-08 15:37\n     7\t\n     8\t---\n     
9\t\n    10\t## 🗺️ 周围房间地图\n    11\t\n    12\t```\n    13\t         E12     
E13        E14\n    14\t        ┌─────────┬─────────┬─────────┐\n    15\t   S34 
│  空     │  空     │ SK Creep │\n    16\t        
├─────────┼─────────┼─────────┤\n    17\t   S35  │ 👤 Lv3  │ 🏠 我   │ SK房间   
│\n    18\t        │ 1 Spawn │ E13S35  │ 4 Lair  │\n    19\t        
├─────────┼─────────┼─────────┤\n    20\t   S36  │  空     │ 👤 Lv4+ │ SK Creep 
│\n    21\t        │         │ 20 Ext  │         │\n    22\t        
└─────────┴─────────┴─────────┘\n    23\t```\n    24\t\n    25\t---\n    26\t\n 
27\t## 👤 邻居档案\n    28\t\n    29\t### E12S35 - Level 3 玩家\n    30\t\n    
31\t| 属性 | 值 |\n    32\t|------|-----|\n    33\t| Level | 3 |\n    34\t| 
Spawn | 1 |\n    35\t| Tower | 0 |\n    36\t| Creeps | 6 |\n    37\t| 威胁等级 |
🟡 中等 |\n    38\t| 备注 | 同级玩家，无 Tower |\n    39\t\n    40\t### E13S36 -
Level 4+ 玩家 ⚠️\n    41\t\n    42\t| 属性 | 值 |\n    43\t|------|-----|\n    
44\t| Level | 4+ (推测) |\n    45\t| Spawn | 1 |\n    46\t| Extension | 20 |\n  
47\t| Tower | 1 |\n    48\t| Construction Sites | 94 |\n    49\t| 威胁等级 | 🟠 
高 |\n    50\t| 备注 | 比我强很多！正在大规模建设 |\n    51\t\n    52\t### 
E14S35 - Source Keeper 房间\n    53\t\n    54\t| 属性 | 值 |\n    
55\t|------|-----|\n    56\t| 类型 | Source Keeper |\n    57\t| Sources | 3 |\n 
58\t| Keeper Lairs | 4 |\n    59\t| 威胁等级 | 🟢 低 |\n    60\t| 备注 | NPC 
守护的中立房间 |\n    61\t\n    62\t---\n    63\t\n    64\t## ⚠️ 威胁评估\n    
65\t\n    66\t| 威胁来源 | 等级 | 说明 |\n    67\t|----------|------|------|\n  
68\t| E12S35 玩家 | 🟡 中 | Level 3，无 Tower，暂时威胁小 |\n    69\t| E14 区域 
| 🟢 低 | Source Keeper 房间，NPC 不会主动攻击 |\n    70\t| E13S36 玩家 | 🟠 高 
| Level 4+, 有 Tower, 94 建造中 |\n    71\t\n    72\t---\n    73\t\n    74\t## 
📅 侦查历史\n    75\t\n    76\t### 2026-01-08\n    77\t\n    78\t- 13:51 - 
**RCL4 最后冲刺！** 🔥🔥🔥🔥\n    79\t  - Level 3, 进度 **129,219/135,000 
(95.7%)**\n    80\t  - **仅差 5,781 点！** 预计 ~5-10 分钟升级！\n    81\t  - 
Creeps: 7 (3H/4U)\n    82\t  - Extensions: 10/10 ✅\n    83\t  - Tower: 
1000/1000 ✅\n    84\t  - Ramparts: 2 (500K+) ✅\n    85\t  - 无敌人，系统稳定 
✅\n    86\t\n    87\t- 13:21 - **RCL4 倒计时！** 🔥🔥🔥\n    88\t  - Level 3, 
进度 **126,008/135,000 (93.3%)**\n    89\t  - 能量: Spawn 278/300, Extensions 
满, Tower 1000/1000 ✅\n    90\t  - Safe Mode 激活中 (76M+ ticks)\n    91\t  - 
Creeps: 7 (3H/4U), 21 WORK parts\n    92\t  - Ramparts: 2 个, HP ~500K ✅ 
(防御坚固)\n    93\t  - 无工地，无敌人\n    94\t  - **距离 RCL4 仅差 ~8,992 
点！** 预计 ~10 分钟升级\n    95\t  - **系统稳定运行中** ✅\n    96\t\n    97\t-
12:26 - **RCL4 即将到来！** 🔥🔥\n    98\t  - Level 3, 进度 **119,909/135,000 
(88.8%)**\n    99\t  - 能量: 容量 800/800 ✅\n   100\t  - Safe Mode 储备 2 次\n 
101\t  - Creeps: 7 (3H/4U), 24 WORK parts\n   102\t  - Tower: 满能量 1000/1000 
✅\n   103\t  - Ramparts: 2 个, HP ~500K ✅ (防御坚固)\n   104\t  - 
无工地，无敌人\n   105\t  - **距离 RCL4 仅差 ~15,091 点！** 预计 ~10-15 
分钟升级\n   106\t  - **RCL4 准备就绪**: Storage 位置 (32,17) 已验证可建造 ✅\n 
107\t  - **系统稳定运行中** ✅\n   108\t\n   109\t- 11:53 - **RCL4 倒计时！** 
🔥\n   110\t  - Level 3, 进度 **115,741/135,000 (85.7%)**\n   111\t  - 能量: 
Spawn 300/300, Extensions 452, Tower 1000/1000 ✅\n   112\t  - Safe Mode 激活中 
(76M+ ticks), 储备 2 次\n   113\t  - Creeps: 7 (3H/4U), 24 WORK parts\n   114\t 
- Ramparts: 2 个, HP ~500K ✅ (防御坚固)\n   115\t  - 无工地，无敌人\n   116\t  
- **距离 RCL4 仅差 ~19,259 点！** 预计 ~15-25 分钟升级\n   117\t  - 
**系统稳定运行中** ✅\n   118\t\n   119\t- 11:41 - **RCL4 倒计时！** 🔥\n   
120\t  - Level 3, 进度 **114,270/135,000 (84.6%)**\n   121\t  - 能量: Spawn 
269/300, Extensions 大部分满, Tower 990/1000\n   122\t  - Safe Mode 激活中 (76M+
ticks), 储备 2 次\n   123\t  - Creeps: 7 (3H/4U), 24 WORK parts\n   124\t  - 
Ramparts: 2 个, HP ~500K ✅ (防御坚固)\n   125\t  - 无工地，无敌人\n   126\t  - 
**距离 RCL4 仅差 ~20,730 点！** 预计 ~0.5-1 小时升级\n   127\t  - 
**系统稳定运行中** ✅\n   128\t\n   129\t- 11:20 - 系统稳定运行，等待 RCL4 🚀\n 
130\t  - Level 3, 进度 **111,829/135,000 (82.8%)**\n   131\t  - 能量: Spawn 
14/300, Extensions 满, Tower 990/1000\n   132\t  - Safe Mode 激活中 (76M+ 
ticks), 储备 2 次\n   133\t  - Creeps: 7 (3H/4U), 21 WORK parts\n   134\t  - 
Ramparts: 2 个, HP ~500K ✅ (防御坚固)\n   135\t  - 无工地，无敌人\n   136\t  - 
**距离 RCL4 仅差 ~23,171 点！** 预计 ~1.5 小时升级\n   137\t  - 
**系统稳定运行中** ✅\n   138\t\n   139\t- 10:33 - **RCL4 即将到来！** 🚀\n   
140\t  - Level 3, 进度 **107,310/135,000 (79.5%)**\n   141\t  - 能量: 800/800 
满载 ✅\n   142\t  - Safe Mode 储备 2 次\n   143\t  - Tower 1000/1000 满能量 
✅\n   144\t  - Creeps: 7 (3H/4U), 21 WORK parts\n   145\t  - Ramparts: 2 个, HP
~500K ✅ (大幅加固)\n   146\t  - 无工地，无敌人\n   147\t  - **距离 RCL4 仅差 
27,690 点！** 预计几小时内升级\n   148\t\n   149\t### 2026-01-07\n   150\t\n   
151\t- 19:27 - 系统稳定运行，等待 RCL4\n   152\t  - Level 3, 进度 29,391/135,000
(21.8%)\n   153\t  - Ramparts: 2 个, HP 88,801 & 9,901 (持续加固中)\n   154\t  -
**系统稳定运行中** ✅\n   155\t\n   156\t- 18:32 - 系统稳定运行，等待 RCL4\n   
157\t  - Level 3, 进度 25,422/135,000 (18.8%)\n   158\t  - Extension 10/10 ✅ 
RCL3 满配\n   159\t  - Creeps: 10 (4H/4U/2B, 19 WORK)\n   160\t  - 
**系统稳定运行中** ✅\n   161\t\n   162\t- 17:58 - Extension 10/10 全部建成! 
✅\n   163\t  - Level 3, 进度 22,874/135,000 (17.0%)\n   164\t  - Tower 
1000/1000 满能量 ✅\n   165\t\n   166\t---\n   167\t\n   168\t*此文件每次 
Session 更新*\n   169\t\n   170\t- 15:37 - **RCL4 建设中** 🟢\n   171\t  - Level
4, 进度 **~2,100/370,000 (0.6%)**\n   172\t  - Creeps: 8 (3H/2U/3B)\n   173\t  -
Extensions: 10/20 已建造\n   174\t    - 1 extension at 80% (31,17)\n   175\t    
- 9 extensions at 0%\n   176\t  - Storage: 0% at (32,17)\n   177\t  - Tower: 
500/1000 ✅\n   178\t  - Ramparts: 2 (497K & 789K HP) ✅\n   179\t  - SafeMode: 
**已结束** - 需警惕攻击\n   180\t  - TTD: ~40K ticks (~11小时) - 安全 ✅\n   
181\t  - 无敌人，系统稳定 ✅\n   182\t  - **当前任务**: 建造 10 Extensions + 
Storage (~57.6K energy)\n   183\t  - **预计完成**: ~2.7 小时\n   184\t\n   
185\t- 14:24 - **RCL4 临门一脚！** 🔥🔥🔥🔥🔥\n   186\t  - Level 3, 进度 
**132,758/135,000 (98.3%)**\n   187\t  - **仅差 ~2,242 点！** 预计 ~2-3 
分钟升级！\n   188\t  - Creeps: 7 (3H/4U) - 全部 W3C2M3 配置\n   189\t  - 
Extensions: 10/10 ✅\n   190\t  - Tower: 1000/1000 ✅\n   191\t  - Ramparts: 2 
(500K+) ✅\n   192\t  - Sources: 2 (2280/3000 & 1872/3000)\n   193\t  - 
无敌人，系统稳定 ✅\n   194\t  - **RCL4 代码准备就绪** ✅\n   195\t\n   196\t- 
14:17 - **RCL4 最终倒计时！** 🔥🔥🔥🔥🔥\n   197\t  - Level 3, 进度 
**131,951/135,000 (97.7%)**\n   198\t  - **仅差 ~3,049 点！** 预计 ~3-5 
分钟升级！\n   199\t  - Creeps: 7 (3H/4U)\n   200\t  - Extensions: 10/10 ✅\n   
201\t  - Tower: 1000/1000 ✅\n   202\t  - Ramparts: 2 (500K+) ✅\n   203\t  - 
无敌人，系统稳定 ✅\n   204\t  - **RCL4 代码准备就绪** ✅\n',
        message='204 lines read from file starting from line 1. End of file 
reached.',
        display=[],
        extras=None
    )
)
StepBegin(n=8)
TextPart(
    type='text',
    text='现在我已经获得了完整的游戏状态。让我更新知识库并总结当前状态：\n\n**当
前游戏状态总结 (2026-01-08 16:10)**:\n- **RCL**: 4 (Progress: 3058/370000 = 
0.8%)\n- **Spawn**: Spawn1 健康 (5000 HP, 36 energy)\n- **Extensions**: 11/20 
已建造 (energy cap: 850)\n- **Towers**: 1 (500 energy)\n- **Storage**: 0 
(建设中)\n- **Ramparts**: 2 (HP: 914K, 495K) ✅ 非常坚固\n- **Creeps**: 10 
(3H/3B/4U 或类似比例) - 满员！\n- **Construction Sites**: 10 (9 extensions + 1 
storage)\n  - 1 extension at 48.3%\n  - 8 extensions at 0%\n  - 1 storage at 
0%\n- **SafeMode**: 已结束 (但有 3 次储备)\n- **无敌人** 
✅\n\n系统运行良好！Creeps 数量增加到 10，建设正在稳步进行中。让我更新 AGENTS.md
和知识库：'
)
ToolCall(
    type='function',
    id='toolu_01JFN3z6iqSCv6khTtCEc5Ev',
    function=FunctionBody(
        name='StrReplaceFile',
        arguments='{"path": "/Users/moonshot/dev/infinite-screeps/AGENTS.md", 
"edit": {"old":"## Current Status\\n\\n- Room: E13S35 (shard3)\\n- **RCL: 4** 
(Progress: 2,796/135,000 towards RCL5 - 2.1%)\\n- Extensions: 11/20 (11 built, 9
under construction)\\n  - 1 extension at ~30% (33,19)\\n  - 8 extensions at 
0%\\n- Storage: under construction (0/30,000) at (32,17)\\n- Tower: 1 at (33,15)
with 500/1000 energy ✅\\n- Ramparts: 2 (Spawn ~495K HP, Tower ~879K HP) ✅\\n- 
Creeps: 9 (3h/3b/3u) - FULL ✅\\n- Construction Sites: 10 (9 extensions + 1 
storage)\\n- Energy Capacity: 850 (Spawn + 11 Extensions)\\n- SafeMode: 
**ENDED** (tick 76628783) - 3 available, watching for attacks\\n- **Current 
tasks:**\\n  - Building 9 Extensions (~27K energy remaining)\\n  - Building 
Storage (30,000 progress needed)\\n  - Total: ~56K energy needed\\n  - Est. 
completion: ~5 hours\\n- **Next goal:**\\n  - Complete all RCL4 buildings (20 
extensions + storage)\\n  - Upgrade to RCL5 (requires ~132K more energy)\\n- 
RCL4 unlocks:\\n  - 20 Extensions (max)\\n  - Storage (1 max)\\n- Last updated: 
2026-01-08 16:02","new":"## Current Status\\n\\n- Room: E13S35 (shard3)\\n- 
**RCL: 4** (Progress: 3,058/370,000 towards RCL5 - 0.8%)\\n- Extensions: 11/20 
(11 built, 9 under construction)\\n  - 1 extension at ~48% progress\\n  - 8 
extensions at 0%\\n- Storage: under construction (0/30,000)\\n- Tower: 1 with 
500/1000 energy ✅\\n- Ramparts: 2 (914K HP, 495K HP) ✅ Very strong!\\n- 
Creeps: 10 (3h/3b/4u) - FULL ✅\\n- Construction Sites: 10 (9 extensions + 1 
storage)\\n- Energy Capacity: 850 (Spawn + 11 Extensions)\\n- SafeMode: 
**ENDED** - 3 available, watching for attacks\\n- **Current tasks:**\\n  - 
Building 9 Extensions (~25.5K energy remaining)\\n  - Building Storage (30,000 
progress needed)\\n  - Total: ~55.5K energy needed\\n  - Est. completion: ~3-4 
hours\\n- **Next goal:**\\n  - Complete all RCL4 buildings (20 extensions + 
storage)\\n  - Upgrade to RCL5 (requires ~367K more energy)\\n- RCL4 unlocks:\\n
- 20 Extensions (max)\\n  - Storage (1 max)\\n- Last updated: 2026-01-08 
16:10"}}'
    ),
    extras=None
)
StatusUpdate(
    context_usage=0.16516,
    token_usage=TokenUsage(
        input_other=1,
        output=1250,
        input_cache_read=26991,
        input_cache_creation=6040
    ),
    message_id='msg_013fnHTwcRWEKwFEKZkH59my'
)
ToolResult(
    tool_call_id='toolu_01JFN3z6iqSCv6khTtCEc5Ev',
    return_value=ToolReturnValue(
        is_error=False,
        output='',
        message='File successfully edited. Applied 1 edit(s) with 1 total 
replacement(s).',
        display=[
            DiffDisplayBlock(
                type='diff',
                path='/Users/moonshot/dev/infinite-screeps/AGENTS.md',
                old_text='## Current Status\n\n- Room: E13S35 (shard3)\n- **RCL:
4** (Progress: 2,796/135,000 towards RCL5 - 2.1%)\n- Extensions: 11/20 (11 
built, 9 under construction)\n  - 1 extension at ~30% (33,19)\n  - 8 extensions 
at 0%\n- Storage: under construction (0/30,000) at (32,17)\n- Tower: 1 at 
(33,15) with 500/1000 energy ✅\n- Ramparts: 2 (Spawn ~495K HP, Tower ~879K HP) 
✅\n- Creeps: 9 (3h/3b/3u) - FULL ✅\n- Construction Sites: 10 (9 extensions + 1
storage)\n- Energy Capacity: 850 (Spawn + 11 Extensions)\n- SafeMode: **ENDED** 
(tick 76628783) - 3 available, watching for attacks\n- **Current tasks:**\n  - 
Building 9 Extensions (~27K energy remaining)\n  - Building Storage (30,000 
progress needed)\n  - Total: ~56K energy needed\n  - Est. completion: ~5 
hours\n- **Next goal:**\n  - Complete all RCL4 buildings (20 extensions + 
storage)\n  - Upgrade to RCL5 (requires ~132K more energy)\n- RCL4 unlocks:\n  -
20 Extensions (max)\n  - Storage (1 max)\n- Last updated: 2026-01-08 16:02',
                new_text='## Current Status\n\n- Room: E13S35 (shard3)\n- **RCL:
4** (Progress: 3,058/370,000 towards RCL5 - 0.8%)\n- Extensions: 11/20 (11 
built, 9 under construction)\n  - 1 extension at ~48% progress\n  - 8 extensions
at 0%\n- Storage: under construction (0/30,000)\n- Tower: 1 with 500/1000 energy
✅\n- Ramparts: 2 (914K HP, 495K HP) ✅ Very strong!\n- Creeps: 10 (3h/3b/4u) - 
FULL ✅\n- Construction Sites: 10 (9 extensions + 1 storage)\n- Energy Capacity:
850 (Spawn + 11 Extensions)\n- SafeMode: **ENDED** - 3 available, watching for 
attacks\n- **Current tasks:**\n  - Building 9 Extensions (~25.5K energy 
remaining)\n  - Building Storage (30,000 progress needed)\n  - Total: ~55.5K 
energy needed\n  - Est. completion: ~3-4 hours\n- **Next goal:**\n  - Complete 
all RCL4 buildings (20 extensions + storage)\n  - Upgrade to RCL5 (requires 
~367K more energy)\n- RCL4 unlocks:\n  - 20 Extensions (max)\n  - Storage (1 
max)\n- Last updated: 2026-01-08 16:10'
            )
        ],
        extras=None
    )
)
StepBegin(n=9)
ToolCall(
    type='function',
    id='toolu_01UD8bAzsRDbRUy6rnZxspwK',
    function=FunctionBody(
        name='StrReplaceFile',
        arguments='{"path": 
"/Users/moonshot/dev/infinite-screeps/knowledge/intel.md", "edit": 
{"old":"**最后更新**: 2026-01-08 15:37","new":"**最后更新**: 2026-01-08 
16:10"}}'
    ),
    extras=None
)
StatusUpdate(
    context_usage=0.171625,
    token_usage=TokenUsage(
        input_other=1,
        output=133,
        input_cache_read=33031,
        input_cache_creation=1293
    ),
    message_id='msg_01RB9yNT5aEAG1M2umktooPe'
)
ToolResult(
    tool_call_id='toolu_01UD8bAzsRDbRUy6rnZxspwK',
    return_value=ToolReturnValue(
        is_error=False,
        output='',
        message='File successfully edited. Applied 1 edit(s) with 1 total 
replacement(s).',
        display=[
            DiffDisplayBlock(
                type='diff',
                path='/Users/moonshot/dev/infinite-screeps/knowledge/intel.md',
                old_text='> 
记录周围玩家和房间的情报，帮助战略决策\n\n**当前房间**: E13S35 (shard3)  
\n**最后更新**: 2026-01-08 15:37\n\n---\n',
                new_text='> 
记录周围玩家和房间的情报，帮助战略决策\n\n**当前房间**: E13S35 (shard3)  
\n**最后更新**: 2026-01-08 16:10\n\n---\n'
            )
        ],
        extras=None
    )
)
StepBegin(n=10)
ToolCall(
    type='function',
    id='toolu_016LiRD9TnxWmhtzxJA4M3kg',
    function=FunctionBody(
        name='StrReplaceFile',
        arguments='{"path": 
"/Users/moonshot/dev/infinite-screeps/knowledge/intel.md", "edit": 
{"old":"*此文件每次 Session 更新*\\n\\n- 15:37 - **RCL4 建设中** 🟢\\n  - Level 
4, 进度 **~2,100/370,000 (0.6%)**\\n  - Creeps: 8 (3H/2U/3B)\\n  - Extensions: 
10/20 已建造\\n    - 1 extension at 80% (31,17)\\n    - 9 extensions at 0%\\n  -
Storage: 0% at (32,17)\\n  - Tower: 500/1000 ✅\\n  - Ramparts: 2 (497K & 789K 
HP) ✅\\n  - SafeMode: **已结束** - 需警惕攻击\\n  - TTD: ~40K ticks (~11小时) -
安全 ✅\\n  - 无敌人，系统稳定 ✅\\n  - **当前任务**: 建造 10 Extensions + 
Storage (~57.6K energy)\\n  - **预计完成**: ~2.7 小时","new":"*此文件每次 
Session 更新*\\n\\n- 16:10 - **RCL4 建设稳步进行** 🟢\\n  - Level 4, 进度 
**3,058/370,000 (0.8%)**\\n  - Creeps: 10 (3H/4U/3B) - 满员! ✅\\n  - 
Extensions: 11/20 已建造\\n    - 1 extension at 48%\\n    - 8 extensions at 
0%\\n  - Storage: 0% (0/30,000)\\n  - Tower: 500/1000 ✅\\n  - Ramparts: 2 (914K
& 495K HP) ✅ 非常坚固!\\n  - SafeMode: **已结束** - 3次储备可用\\n  - 
无敌人，系统稳定 ✅\\n  - **当前任务**: 建造 9 Extensions + Storage (~55.5K 
energy)\\n  - **预计完成**: ~3-4 小时\\n\\n- 15:37 - **RCL4 建设中** 🟢\\n  - 
Level 4, 进度 **~2,100/370,000 (0.6%)**\\n  - Creeps: 8 (3H/2U/3B)\\n  - 
Extensions: 10/20 已建造\\n    - 1 extension at 80% (31,17)\\n    - 9 extensions
at 0%\\n  - Storage: 0% at (32,17)\\n  - Tower: 500/1000 ✅\\n  - Ramparts: 2 
(497K & 789K HP) ✅\\n  - SafeMode: **已结束** - 需警惕攻击\\n  - TTD: ~40K 
ticks (~11小时) - 安全 ✅\\n  - 无敌人，系统稳定 ✅\\n  - **当前任务**: 建造 10 
Extensions + Storage (~57.6K energy)\\n  - **预计完成**: ~2.7 小时"}}'
    ),
    extras=None
)
StatusUpdate(
    context_usage=0.172615,
    token_usage=TokenUsage(
        input_other=1,
        output=1458,
        input_cache_read=34324,
        input_cache_creation=198
    ),
    message_id='msg_01WjqHb7y2QqEboqMjuDniEy'
)
ToolResult(
    tool_call_id='toolu_016LiRD9TnxWmhtzxJA4M3kg',
    return_value=ToolReturnValue(
        is_error=False,
        output='',
        message='File successfully edited. Applied 1 edit(s) with 1 total 
replacement(s).',
        display=[
            DiffDisplayBlock(
                type='diff',
                path='/Users/moonshot/dev/infinite-screeps/knowledge/intel.md',
                old_text='\n*此文件每次 Session 更新*\n\n- 15:37 - **RCL4 
建设中** 🟢\n  - Level 4, 进度 **~2,100/370,000 (0.6%)**\n  - Creeps: 8 
(3H/2U/3B)',
                new_text='\n*此文件每次 Session 更新*\n\n- 16:10 - **RCL4 
建设稳步进行** 🟢\n  - Level 4, 进度 **3,058/370,000 (0.8%)**\n  - Creeps: 10 
(3H/4U/3B) - 满员! ✅\n  - Extensions: 11/20 已建造\n    - 1 extension at 48%\n 
- 8 extensions at 0%\n  - Storage: 0% (0/30,000)\n  - Tower: 500/1000 ✅\n  - 
Ramparts: 2 (914K & 495K HP) ✅ 非常坚固!\n  - SafeMode: **已结束** - 
3次储备可用\n  - 无敌人，系统稳定 ✅\n  - **当前任务**: 建造 9 Extensions + 
Storage (~55.5K energy)\n  - **预计完成**: ~3-4 小时\n\n- 15:37 - **RCL4 
建设中** 🟢\n  - Level 4, 进度 **~2,100/370,000 (0.6%)**\n  - Creeps: 8 
(3H/2U/3B)'
            )
        ],
        extras=None
    )
)
StepBegin(n=11)
TextPart(type='text', text='现在让我提交更新：')
ToolCall(
    type='function',
    id='toolu_016Pd7dDjKfFjfKe3k4hEXPr',
    function=FunctionBody(
        name='Shell',
        arguments='{"command": "cd /Users/moonshot/dev/infinite-screeps && git 
add -A && git commit -m \\"[status] RCL4 建设进行中 - 11/20 Extensions, 10 
Creeps\\""}'
    ),
    extras=None
)
StatusUpdate(
    context_usage=0.18009,
    token_usage=TokenUsage(
        input_other=1,
        output=112,
        input_cache_read=34522,
        input_cache_creation=1495
    ),
    message_id='msg_01AftfPcDd51LhkK1CUa3Pyn'
)
ToolResult(
    tool_call_id='toolu_016Pd7dDjKfFjfKe3k4hEXPr',
    return_value=ToolReturnValue(
        is_error=False,
        output='[main d332ff2] [status] RCL4 建设进行中 - 11/20 Extensions, 10 
Creeps\n 6 files changed, 1480 insertions(+), 13 deletions(-)\n create mode 
100644 events/processed_1767859831.json\n create mode 100644 
logs/session_1_20260108_161033.log\n',
        message='Command executed successfully.',
        display=[],
        extras=None
    )
)
StepBegin(n=12)
TextPart(
    type='text',
    text='✅ **Session 完成！**\n\n## 状态总结\n\n| 指标 | 数值 | 状态 
|\n|------|------|------|\n| RCL | 4 (0.8%) | 🟢 |\n| Creeps | 10 | ✅ 满员 |\n|
Extensions | 11/20 | 🔨 建设中 |\n| Storage | 0/30K | 🔨 建设中 |\n| Tower | 1 
(500 energy) | ✅ |\n| Ramparts | 2 (914K/495K HP) | ✅ 非常坚固 |\n| 敌人 | 无 
| ✅ |\n| SafeMode | 已结束 (3储备) | ⚠️ 注意 |\n\n## 当前进度\n- **1 Extension**
建设中 (48%)\n- **8 Extensions** 队列中\n- **1 Storage** 队列中\n- 预计 ~3-4 
小时完成所有 RCL4 建筑\n\n## 系统状态\n- ✅ 代码运行正常\n- ✅ Creeps 满员 
(3H/3B/4U)\n- ✅ 防御坚固 (Ramparts 近 100 万 HP)\n- ✅ Tower 
半满能量\n\n**无需任何代码修改，系统稳定运行中。**'
)
StatusUpdate(
    context_usage=0.18124,
    token_usage=TokenUsage(
        input_other=1,
        output=390,
        input_cache_read=36017,
        input_cache_creation=230
    ),
    message_id='msg_01JUN26Ro1Xw5W29g5GHCKEL'
)
